restaurant_name,link,date,rating,title,review
Al Bawadi Restaurant,https://www.tripadvisor.com/Restaurant_Review-g35712-d2243156-Reviews-Al_Bawadi_Restaurant-Bridgeview_Illinois.html,"January 19, 2016",4,Great experience,"Although the food was great, there's much more that this place has to offer. They've done their best to give it an authentic Arabian feeling, and their appetizers are absolutely delicious, making for a great experience before even ordering anything! The portions are large for...More"
Al Bawadi Restaurant,https://www.tripadvisor.com/Restaurant_Review-g35712-d2243156-Reviews-Al_Bawadi_Restaurant-Bridgeview_Illinois.html,"January 5, 2016",3,Worst management ,"The food is good I'd give it 4 stars, desert 1 star (they really need help here), the atmosphere is ok as well 4 stars, but come to customer service 2 stars, not all the servers are as bad but the majority are. The biggest...More"
Al Bawadi Restaurant,https://www.tripadvisor.com/Restaurant_Review-g35712-d2243156-Reviews-Al_Bawadi_Restaurant-Bridgeview_Illinois.html,"January 3, 2016",1,bad and stupid management,"food is not so bad (average), but dealing with customers needs a major rehab, turned our birthday party to a nightmare just because they want to sell us more of their $6 cakes they lost my biz of at least $2500 or 43000 a year...More"
Al Bawadi Restaurant,https://www.tripadvisor.com/Restaurant_Review-g35712-d2243156-Reviews-Al_Bawadi_Restaurant-Bridgeview_Illinois.html,"January 1, 2016",1,bad customer service,One of the worst ever experience in an Arabic restaurant.. And this doesn't come from eating more than how they deal with their customers... I really regret going there... I was at the door getting a table and after I gave my name to get...More
Al Bawadi Restaurant,https://www.tripadvisor.com/Restaurant_Review-g35712-d2243156-Reviews-Al_Bawadi_Restaurant-Bridgeview_Illinois.html,"November 14, 2015",5,Wow,Mashallah very nice food   I think it is the best in Chicago   Try fried kobah....khayal ;)  I ordered shesh kabab with Homas and kobah.
Al Bawadi Restaurant,https://www.tripadvisor.com/Restaurant_Review-g35712-d2243156-Reviews-Al_Bawadi_Restaurant-Bridgeview_Illinois.html,"September 9, 2015",5,Best food in town ,If you every in the Chicago area you should go and try Al Bawadi restaurant they have the best hummus and the the best mix grill in town
Al Bawadi Restaurant,https://www.tripadvisor.com/Restaurant_Review-g35712-d2243156-Reviews-Al_Bawadi_Restaurant-Bridgeview_Illinois.html,"August 23, 2015",5,The best Chicken Shish Tawook on real charcoal grill,"we have a large Arabic community in our area and one of the many benefits is the great food!! My barber told me to go to this restaurant because of the real charcoal grill.  The Chicken Shish Tawook, Kufta Kebab, Shish Kebab, Tabouleh Salad, and...More"
Al Bawadi Restaurant,https://www.tripadvisor.com/Restaurant_Review-g35712-d2243156-Reviews-Al_Bawadi_Restaurant-Bridgeview_Illinois.html,"August 12, 2015",5,Great Mediterranean food,"Excellent food with many choices.  Good selection of starters. Service was good, a nice atmosphere, and fair pricing. The sampler platers have an abundance of food and salads are great for sharing."
Al Bawadi Restaurant,https://www.tripadvisor.com/Restaurant_Review-g35712-d2243156-Reviews-Al_Bawadi_Restaurant-Bridgeview_Illinois.html,"July 19, 2015",5,Best Middle Eastern food,My family and I went to Al Bawadi for the second time. Their food and service is by far one of the best I have seen in any Middle Eastern restaurant. We will definitely go back again!!
Al Bawadi Restaurant,https://www.tripadvisor.com/Restaurant_Review-g35712-d2243156-Reviews-Al_Bawadi_Restaurant-Bridgeview_Illinois.html,"July 13, 2015",4,Mixed review,"We went there twice during our trip to Chicago. The group I was with are Egyptian and they wanted something familiar for breaking their fast. The first time we went the service was great, but the food was average. The second time we went the...More"
Al Bawadi Restaurant,https://www.tripadvisor.com/Restaurant_Review-g35712-d2243156-Reviews-Al_Bawadi_Restaurant-Bridgeview_Illinois.html,"June 15, 2015",5,Great Family Dining,"Very convenient checkin system with tablet that will text your phone when table is ready.  Fun sights, sounds, and smells.  Lots of families there.  Service is good, as the restaurant is busy, dont expect private attention all the time.  Food is amazing! Served hot and...More"
Al Bawadi Restaurant,https://www.tripadvisor.com/Restaurant_Review-g35712-d2243156-Reviews-Al_Bawadi_Restaurant-Bridgeview_Illinois.html,"June 12, 2015",4,True arabic food.,I went back to my days in uae after a meal at this place. Same taste same ambiance.  Hummus was amazing as well as the mixed grill and shawarma platter.
Al Bawadi Restaurant,https://www.tripadvisor.com/Restaurant_Review-g35712-d2243156-Reviews-Al_Bawadi_Restaurant-Bridgeview_Illinois.html,"June 11, 2015",5,Amazing food,"I had keba, grape leaves, hummus, tabolah, and mixed grill. The food was great. The atmosphere was another story.  Recommended and for sure will be there again"
Al Bawadi Restaurant,https://www.tripadvisor.com/Restaurant_Review-g35712-d2243156-Reviews-Al_Bawadi_Restaurant-Bridgeview_Illinois.html,"April 1, 2015",1,Horrible service!!,"The food is ok (I have in-laws by Dearborn so this is nothing special). But the service is HORRIBLE!!!   I have made reservations here 3 times, usually days in advance. And 3 times, the host has given my table away and made me wait, always...More"
Al Bawadi Restaurant,https://www.tripadvisor.com/Restaurant_Review-g35712-d2243156-Reviews-Al_Bawadi_Restaurant-Bridgeview_Illinois.html,"March 27, 2015",1,Nightmare!!! Rude and selfish owner,"We made a reservation for 8:30 pm and were there by 8:35 and were told our table won't be ready for another 15 minutes. Meanwhile, the owner was holding a table for his own party. When we asked why we cannot be seated when there...More"
Al Bawadi Restaurant,https://www.tripadvisor.com/Restaurant_Review-g35712-d2243156-Reviews-Al_Bawadi_Restaurant-Bridgeview_Illinois.html,"March 16, 2015",5,Everything is always awesome!,"I live in KY and I come to Chicago alot. I always stop by here, their food is the best, it's good even when its cold."
Al Bawadi Restaurant,https://www.tripadvisor.com/Restaurant_Review-g35712-d2243156-Reviews-Al_Bawadi_Restaurant-Bridgeview_Illinois.html,"February 10, 2015",5,GRATE TASTE OF MIDDLEEAST,"Had reservation for my daughter birthday. I ask for corner booth which mimics inside of Arabic tent. Very friendly stuff in traditional outfits. Grate coffee with ginger and mint tea.Freshly made juices and lemonade. Grate appetizers. Be careful , big , biiiig main course dishes....More"
Al Bawadi Restaurant,https://www.tripadvisor.com/Restaurant_Review-g35712-d2243156-Reviews-Al_Bawadi_Restaurant-Bridgeview_Illinois.html,"January 1, 2015",4,"Excellent food, decent service, a bit overpriced","I come from a city filled with options for Middle Eastern restaurants, so this place is being compared to some of the greatest restaurants in North America.   Food: 9/10 I don't give out 10s unless the food is drop-dead amazing. This food was great and...More"
Al Bawadi Restaurant,https://www.tripadvisor.com/Restaurant_Review-g35712-d2243156-Reviews-Al_Bawadi_Restaurant-Bridgeview_Illinois.html,"December 20, 2014",5,Awesome and authentic,This is a very good restaurant with great food and service.  The decor is beautiful and the staff is very knowledgeable.  I always go for the mixed grill and every time I take a bite of the fooday I thank God and feel like I...More
Al Bawadi Restaurant,https://www.tripadvisor.com/Restaurant_Review-g35712-d2243156-Reviews-Al_Bawadi_Restaurant-Bridgeview_Illinois.html,"December 2, 2014",5,Great food,"I went here with my family based on a friend's recommendation. We thought it was just your typical Middle Eastern/Arabian food but when we tried it we were glad we were wrong! We ordered the meat platter, good for 5 people, and it was more...More"
Al Bawadi Restaurant,https://www.tripadvisor.com/Restaurant_Review-g35712-d2243156-Reviews-Al_Bawadi_Restaurant-Bridgeview_Illinois.html,"November 30, 2014",5,Excellent arabic cuisine!,I visited this restaurant with 4 of my friends while on trip to Chicago. I have to say that it is the most amazing lebanese cuisine I have ever tasted in the US... truly authentic food and arab atmosphere. We ordered the full buffet. Every...More
Al Bawadi Restaurant,https://www.tripadvisor.com/Restaurant_Review-g35712-d2243156-Reviews-Al_Bawadi_Restaurant-Bridgeview_Illinois.html,"November 10, 2014",5,Excellent food & selection.  Beautiful atmosphere,My husband & I had lunch here at it was wonderful.  The selections on the menu are plentiful and the food tasted great.  The ceilings are draped in fabric so the restaurant is very pretty.  We are not middle eastern but the staff made us...More
Al Bawadi Restaurant,https://www.tripadvisor.com/Restaurant_Review-g35712-d2243156-Reviews-Al_Bawadi_Restaurant-Bridgeview_Illinois.html,"September 24, 2014",5,It is one of the best meals I had in a middle eastern speciality restaurant,"The food was very tasty and reasonably priced we ordered meat (mixed grill), fish Talabia, and quail cooked on charcoal , all the food was  cooked to perfection the presentation of the food on a special designed plates, for each item and the service was...More"
Al Bawadi Restaurant,https://www.tripadvisor.com/Restaurant_Review-g35712-d2243156-Reviews-Al_Bawadi_Restaurant-Bridgeview_Illinois.html,"September 4, 2014",5,Alwayes good food,"I have been going to this restaurant for the last 5 years , always good quality food, their quality never changed , recently they remodeled the place and it looks good, keep up the good work guys."
Al Bawadi Restaurant,https://www.tripadvisor.com/Restaurant_Review-g35712-d2243156-Reviews-Al_Bawadi_Restaurant-Bridgeview_Illinois.html,"August 28, 2014",5,Great atmosphere,This is one of my favorite places to go for middle eastern food. The staff is great just like the food. Large portion sizes means you will be bring some of what ever you order home. You cannot go wrong here.
Al Bawadi Restaurant,https://www.tripadvisor.com/Restaurant_Review-g35712-d2243156-Reviews-Al_Bawadi_Restaurant-Bridgeview_Illinois.html,"August 24, 2014",5,Great arab cuisine !!!,"I visited the place while on vacation, and was craving for arab food and Was recommended this place, the food was amazing! The taste was original and the serving was above expectations. All in all, I recommend this for anyone who would to enjoy true...More"
Al Bawadi Restaurant,https://www.tripadvisor.com/Restaurant_Review-g35712-d2243156-Reviews-Al_Bawadi_Restaurant-Bridgeview_Illinois.html,"August 6, 2014",4,Great food and service,This restaurant makes the best humus I've ever tasted. Their lamb chops are also great. I really liked the atmosphere and the service and will try to come back again whenever in Chicago.
Al Bawadi Restaurant,https://www.tripadvisor.com/Restaurant_Review-g35712-d2243156-Reviews-Al_Bawadi_Restaurant-Bridgeview_Illinois.html,"May 28, 2014",5,Great Middle Eastern food,"Great tasting food, ample portions, great & friendly service. A good variety of tastes. Get different platters and share."
Al Bawadi Restaurant,https://www.tripadvisor.com/Restaurant_Review-g35712-d2243156-Reviews-Al_Bawadi_Restaurant-Bridgeview_Illinois.html,"May 16, 2014",5,Wonderful Restaurant,"This was the second visit for me to this restaurant, it is one of the best arabian restaurants in Chicago. The food was really delicious, waiters are friendly, the appetizers YUMMY. The meat was juicy and tender.   Highly recommended restaurant .. Must eat at this...More"
Al Bawadi Restaurant,https://www.tripadvisor.com/Restaurant_Review-g35712-d2243156-Reviews-Al_Bawadi_Restaurant-Bridgeview_Illinois.html,"May 7, 2014",5,Wonderful and authentic,"Out of the many Mediterranean restaurants I've eaten at in Chicago, or the Chicagoland area, this by far my favorite. I generally order the lamb chops and it's always cooked to perfection. It's served with 2 different rices, with is a great pair. I've also...More"
Al Bawadi Restaurant,https://www.tripadvisor.com/Restaurant_Review-g35712-d2243156-Reviews-Al_Bawadi_Restaurant-Bridgeview_Illinois.html,"May 1, 2014",5,Best in all of US,"Second visit here and let me tell you that its worth the drive, only 30 minutes from downtown Chicago. Found the same waiter "" Ahmed"" he always does a great job. Look the complimentary appetizer and warm pita bread. I ordered the toshka and seriously...More"
Al Bawadi Restaurant,https://www.tripadvisor.com/Restaurant_Review-g35712-d2243156-Reviews-Al_Bawadi_Restaurant-Bridgeview_Illinois.html,"April 20, 2014",3,"Great Food, Terrible Service","I have been to this restaurant a few times.  I love the food.  If not for the quality of the food, I would never go back because the service needs major improvements.  I think starting from the manager who was rude and arrogant when I...More"
Al Bawadi Restaurant,https://www.tripadvisor.com/Restaurant_Review-g35712-d2243156-Reviews-Al_Bawadi_Restaurant-Bridgeview_Illinois.html,"April 20, 2014",4,Awesome Food,Really nice decor and the waitresses and waitress costume were really pretty. The food was good but now they have limited the food quite a bit for the price they are charging
Al Bawadi Restaurant,https://www.tripadvisor.com/Restaurant_Review-g35712-d2243156-Reviews-Al_Bawadi_Restaurant-Bridgeview_Illinois.html,"April 8, 2014",2,Food okay - horrible service,"Had a surprise birthday party for my husband ... Some people were coming in a little later and the manager was ready to kick us out.  He was yelling at us in front of the guests... Extremely embarrassing.  Then.. On top of everything, the lady...More"
Al Bawadi Restaurant,https://www.tripadvisor.com/Restaurant_Review-g35712-d2243156-Reviews-Al_Bawadi_Restaurant-Bridgeview_Illinois.html,"February 25, 2014",5,Great Place For Middle Eastern,"Go here for my birthdays. We go all out and order the huge mammoth sized metal serving dishes called saniyes that's the size of a 28' pizza in multiples of three. Hummus is pheneminal and bread served hot. Babaghanoush is really good too, even if...More"
Al Bawadi Restaurant,https://www.tripadvisor.com/Restaurant_Review-g35712-d2243156-Reviews-Al_Bawadi_Restaurant-Bridgeview_Illinois.html,"January 19, 2014",5,One of the best meals I have had outside the middle east,"This place was absolutely great.  The service was a little slow, but that is indicative of the type of restaurant.  While I was traveling in Turkey the service was about the same, and I really did not have an issue here.   We were not in...More"
Al Bawadi Restaurant,https://www.tripadvisor.com/Restaurant_Review-g35712-d2243156-Reviews-Al_Bawadi_Restaurant-Bridgeview_Illinois.html,"December 10, 2013",4,Middle Eastern touch!!!,"We were there on a road trip and we found this place online as we were looking for Halal places near our hotel. The place was packaged on a Sunday! and we nearly left, but when asked they told us to wait for 15 mins,...More"
Al Bawadi Restaurant,https://www.tripadvisor.com/Restaurant_Review-g35712-d2243156-Reviews-Al_Bawadi_Restaurant-Bridgeview_Illinois.html,"November 30, 2013",1,"""Bad customer service""",My friend and I decided to do something different so we went to Albawadi for dinner what a mistake!!! we placed out order which took forever to come out!!! plus we order 2 drinks with food and we never received our drinks!!!! our waitress vanished...More
Al Bawadi Restaurant,https://www.tripadvisor.com/Restaurant_Review-g35712-d2243156-Reviews-Al_Bawadi_Restaurant-Bridgeview_Illinois.html,"November 28, 2013",5,Happy Birthday Suprise,"Went with my family for my birthday. Staff went out of their way to make it outstanding. Even sang to me, in Arabic!"
Al Bawadi Restaurant,https://www.tripadvisor.com/Restaurant_Review-g35712-d2243156-Reviews-Al_Bawadi_Restaurant-Bridgeview_Illinois.html,"November 12, 2013",5,A great place to bring an out of town guest!,"Al Bawadi Restaurant is a great place to bring an out-of-town guest for any occasion.  The decor of the restaurant is decorated Middle Eastern style, along with a wait staff dressed in Middle Eastern style clothing.  The atmosphere is a fun and friendly place.  The...More"
Al Bawadi Restaurant,https://www.tripadvisor.com/Restaurant_Review-g35712-d2243156-Reviews-Al_Bawadi_Restaurant-Bridgeview_Illinois.html,"October 31, 2013",4,"Great environment, better food!","I've been to this restaurant many times for many different occasions. I've been there to celebrate family functions, taken my wife there, and been there with friends and it never disappoints. Sometimes the service can be a little slow but overall it's good. The food...More"
Al Bawadi Restaurant,https://www.tripadvisor.com/Restaurant_Review-g35712-d2243156-Reviews-Al_Bawadi_Restaurant-Bridgeview_Illinois.html,"October 27, 2013",5,Excellent Food- Nice Atmosphere,Went for a dinner to this authentic middle eastern restaurant with some friends and was completely overwhelmed by not only the excellent & delicious food that was served to us at very reasonable prices but portions that were huge!  That and the authentic feel to...More
Al Bawadi Restaurant,https://www.tripadvisor.com/Restaurant_Review-g35712-d2243156-Reviews-Al_Bawadi_Restaurant-Bridgeview_Illinois.html,"October 13, 2013",5,My Favorite Restaurant,I have been here many times with both small and big groups. Everyone loved the food. The Lamb chops and Special Large Meat Platter are my favorite and everyone loves their food.
Al Bawadi Restaurant,https://www.tripadvisor.com/Restaurant_Review-g35712-d2243156-Reviews-Al_Bawadi_Restaurant-Bridgeview_Illinois.html,"October 2, 2013",5,Awesome Food,"I am a Middle Eastern and I really don't like to east Middle Eastern Food from restaurants, but my wife took me here. I told her that she now has some mean competition when it comes to cooking. I ordered the Bawadi Grill Mix. Let...More"
Al Bawadi Restaurant,https://www.tripadvisor.com/Restaurant_Review-g35712-d2243156-Reviews-Al_Bawadi_Restaurant-Bridgeview_Illinois.html,"September 3, 2013",5,The best Middle Eastern food I've had outside of Jordan,"Never mind the authentic settings, the hospitable staff, and the delicious food. It's the combination of all of these that make Al Bawadi a true home away from home experience. Upon arrival, you are greeted by the hostess who will do her best to accommodate...More"
Al Bawadi Restaurant,https://www.tripadvisor.com/Restaurant_Review-g35712-d2243156-Reviews-Al_Bawadi_Restaurant-Bridgeview_Illinois.html,"September 2, 2013",4,Middle east delights,"The food at Al Bawadi is excellent and the portions are generous.  They start you with an appetizer platter with seasoned pita strips, dip and relish.  We ordered a meat sampler platter (for 5 per the menu), which was more than enough food for our...More"
Al Bawadi Restaurant,https://www.tripadvisor.com/Restaurant_Review-g35712-d2243156-Reviews-Al_Bawadi_Restaurant-Bridgeview_Illinois.html,"August 24, 2013",5,A taste of the Middle East on the outskirts of Chicago,Al Bawadi has a wonderful interior that they newly decorated.  It is colorful & cozy.  The food is just out of this world.  Everything I've had is delicious. They start you with a mini appetizer platter & pita bread.  They have several entrees to choose...More
Al Bawadi Restaurant,https://www.tripadvisor.com/Restaurant_Review-g35712-d2243156-Reviews-Al_Bawadi_Restaurant-Bridgeview_Illinois.html,"August 8, 2013",4,Very good food,"This place is very good if you like Lebanese style Middle Eastern food. We like the sandwiches, the kefta and the kebab. I enjoy the pickles and the bread, before the meal."
Al Bawadi Restaurant,https://www.tripadvisor.com/Restaurant_Review-g35712-d2243156-Reviews-Al_Bawadi_Restaurant-Bridgeview_Illinois.html,"September 28, 2012",5,"great food, generous portions",we ate at al bawadi in august. the food was delicious -- my only complaint would be that there was too much of it!  our group of 4 ordered 4 combination plates -- 2 seafood and 2 meat. we would have had plenty of food...More
Al Bawadi Restaurant,https://www.tripadvisor.com/Restaurant_Review-g35712-d2243156-Reviews-Al_Bawadi_Restaurant-Bridgeview_Illinois.html,"September 3, 2012",1,Everything was wrong,"We have been here twice now, both times we were seated and both times we were forgotten about-- we were charged for drinks we didnt receive and no matter how hard we tried we couldnt keep the staff aware we existed-- we were 5 people...More"
Al Bawadi Restaurant,https://www.tripadvisor.com/Restaurant_Review-g35712-d2243156-Reviews-Al_Bawadi_Restaurant-Bridgeview_Illinois.html,"August 8, 2012",1,Good food and Restaurant but few issues..,We usually dine or carry out from Albawadi and everything was fine few time we've been there. But the last 2 times it has been so horrible . We took our friend there we all ordered together our food came out fast which was great...More
Al Bawadi Restaurant,https://www.tripadvisor.com/Restaurant_Review-g35712-d2243156-Reviews-Al_Bawadi_Restaurant-Bridgeview_Illinois.html,"July 5, 2012",5,Love their food!!!!!,"We went to this restaurant with friends from Saudi Arabia, they ordered all the food, and let me tell you it was delicious.  I had visited other arabian restaurants, but this is something else, even their decoration is outstanding.  The best cooked lamb I ever...More"
Al Bawadi Restaurant,https://www.tripadvisor.com/Restaurant_Review-g35712-d2243156-Reviews-Al_Bawadi_Restaurant-Bridgeview_Illinois.html,"May 29, 2012",5,Believe those taxi drivers!,"Our Jordanian taxi driver from O'Hare to Oak Park recommended Al Bawadi for great Mansaf, a dish my husband and I enjoyed very much in Jordan a year or so ago. The tender-cooked lamb in yogurt sauce was served on a bed of savory rice...More"
Al Bawadi Restaurant,https://www.tripadvisor.com/Restaurant_Review-g35712-d2243156-Reviews-Al_Bawadi_Restaurant-Bridgeview_Illinois.html,"April 23, 2012",4,Good food but....,"Good food, attentive wait staff, but not very friendly. They are just there to basically take your order and delivery it to your table, dont expect a smiling reception from your server."
Al Bawadi Restaurant,https://www.tripadvisor.com/Restaurant_Review-g35712-d2243156-Reviews-Al_Bawadi_Restaurant-Bridgeview_Illinois.html,"April 1, 2012",5,Spoiled me for other places...,"Always super busy, this place is one of those that we make sure we have time for in the Chicagoland area. I could go on and on but I will keep it simple...  Their lemonade...so good. Shawarma (chicken)... beyond good. I couldn't wrestle the ingredients...More"
Al Bawadi Restaurant,https://www.tripadvisor.com/Restaurant_Review-g35712-d2243156-Reviews-Al_Bawadi_Restaurant-Bridgeview_Illinois.html,"November 2, 2011",3,Good food but bad service,"This restaurant has everything...good food, nice atmosphere but the only thing that it lacks is SERVICE.  My first experience was good but the second visit was horrible. Very rude waitresses with lots of ego and attitude. Instead bring food home and eat. Not a place...More"
Al Bawadi Restaurant,https://www.tripadvisor.com/Restaurant_Review-g35712-d2243156-Reviews-Al_Bawadi_Restaurant-Bridgeview_Illinois.html,"September 24, 2011",5,A fulfilling dining experience!,"The food was incredible! The atmosphere was beautiful. The servers were impeccably dressed and were courteous! It was a memorable dining experience. Tip: if you order the platter for five, it'll take ten people to finish it! Portions are generous! A meat eaters heaven!!!"
The Patio,https://www.tripadvisor.com/Restaurant_Review-g35712-d3598986-Reviews-The_Patio-Bridgeview_Illinois.html,"March 7, 2021",5,I love this place!,"When I'm looking for quality food but don't feel like cooking, The Patio is my go-to place.  I love their salads, chili, and barbeque chicken.  Yum!"
The Patio,https://www.tripadvisor.com/Restaurant_Review-g35712-d3598986-Reviews-The_Patio-Bridgeview_Illinois.html,"March 2, 2020",5,Nice Place,"Visit here frequently, they have great food at reasonable prices.   Service staff is friendly and courteous.   Most recent visit saw where they have added some nice entrees for the lenten season."
The Patio,https://www.tripadvisor.com/Restaurant_Review-g35712-d3598986-Reviews-The_Patio-Bridgeview_Illinois.html,"January 30, 2020",5,Late Thursday lunch,Had the hamburger with garlic mashed potatoes instead of fries. Also the no caffeine root beer. One of my favorite places when I am alone. Many TVs to watch sports.
The Patio,https://www.tripadvisor.com/Restaurant_Review-g35712-d3598986-Reviews-The_Patio-Bridgeview_Illinois.html,"August 2, 2019",4,Would eat here often,"Met a friend here for dinner.  The variety of the menu was surprising: bbq, salads, sandwiches, ribs, etc.  There was a lot to choose from.  Restaurant was clean and roomy.  I would eat at this location often if I lived in the area.  It has...a lot to offer.More"
The Patio,https://www.tripadvisor.com/Restaurant_Review-g35712-d3598986-Reviews-The_Patio-Bridgeview_Illinois.html,"July 4, 2019",4,Good option for a quick and reasonably priced meal,"Easy to order, large menus on wall. Food delivered to table within 10 minutes by polite man. Establishment was clean. Outdoor seating is available. Parking is easy with plenty of spaces. A variety of food and drink options are available."
