restaurant_name,link,date,rating,title,review
The Patio,https://www.tripadvisor.com/Restaurant_Review-g35712-d3598986-Reviews-The_Patio-Bridgeview_Illinois.html,"May 27, 2019",5,There's no Spare Ribs around once dinner is finished!,"Great place for lunch or dinner, excellent service and awesome food, especially the spare ribs. Once you have finished your meal, the plate will be a clean as a whistle! Decent parking either just outside the door or around the back. If you prefer, they...offer take out.More"
The Patio,https://www.tripadvisor.com/Restaurant_Review-g35712-d3598986-Reviews-The_Patio-Bridgeview_Illinois.html,"May 23, 2019",5,Lunch with the family,"Very clean restaurant, food is excellent , employees very friendly, pulled pork sandwich, submarine sandwich, chili dogs, french  fries, fried zuchinni, excellent."
The Patio,https://www.tripadvisor.com/Restaurant_Review-g35712-d3598986-Reviews-The_Patio-Bridgeview_Illinois.html,"April 14, 2019",4,Great food,"Orderered chicken bbq dinner and hubby ordered rib combo with beef brisket, everything taste good! friends ordered burger and taco and they enjoyed them too. ambiance is great, spacious and with good lighting. service is fast. place is clean. A bit pricey but with big...serving. will come back to try other food in their menu!More"
The Patio,https://www.tripadvisor.com/Restaurant_Review-g35712-d3598986-Reviews-The_Patio-Bridgeview_Illinois.html,"March 18, 2019",5,Soup ,Most of the food I have found to be fine. Average fast food.  But the soup is the reason to come. The cream of chicken rice soup is the the best anywhere.
The Patio,https://www.tripadvisor.com/Restaurant_Review-g35712-d3598986-Reviews-The_Patio-Bridgeview_Illinois.html,"February 16, 2019",4,Still loving those ribs,"Been absent from the area for decades. Returned to the new rendition of The Patio Still have great ribs, worked for me!"
The Patio,https://www.tripadvisor.com/Restaurant_Review-g35712-d3598986-Reviews-The_Patio-Bridgeview_Illinois.html,"January 19, 2019",5,Best Ribs,"I visit my parents in Burbank often and have eaten at the Patio since the mid 80's, this place has been and remains the place for AWESOME ribs.  The rest of their menu is very good as well, but I can remember eating ribs and...More"
The Patio,https://www.tripadvisor.com/Restaurant_Review-g35712-d3598986-Reviews-The_Patio-Bridgeview_Illinois.html,"October 21, 2018",4,Consistently solid good simple eats,I get three things here: -Caesar salad with chicken breast -choppped salad -chicken shish kabobs  They do my chicken perfectly.  I ask for it well done and get a nice char with still juicy middle.  And ONLY AT THIS LOCATION:  go to the carry out...More
The Patio,https://www.tripadvisor.com/Restaurant_Review-g35712-d3598986-Reviews-The_Patio-Bridgeview_Illinois.html,"June 23, 2018",2,Food could of been better!,"Been going there for 30 years, Went this week. We ordered 1 Rib dinner $21.95 With 2 Bowls of soup and one pop and one water. Bill $36.80  Ribs were over cooked and very dry. Soup was very bland.John who is the owner,Great guy. But...More"
The Patio,https://www.tripadvisor.com/Restaurant_Review-g35712-d3598986-Reviews-The_Patio-Bridgeview_Illinois.html,"December 23, 2017",5,Great American food,"Short order quick table service and great food. They even serve micro brew now. If you are looking for something more than a hot dog joint but not a formal sit down restaurant, then one of The Patio restaurants are what you are looking for"
The Patio,https://www.tripadvisor.com/Restaurant_Review-g35712-d3598986-Reviews-The_Patio-Bridgeview_Illinois.html,"August 8, 2017",5,Great place for barbeque.,"They serve a pulled pork sandwich which is so big, I wouldn't put that much  meat on one at home. We frequently split one between my wife and me. The ribs are my favorite kind. The meat does not fall off the bone. I like...More"
The Patio,https://www.tripadvisor.com/Restaurant_Review-g35712-d3598986-Reviews-The_Patio-Bridgeview_Illinois.html,"July 24, 2017",4,BBQ,I had been wanting to check this place out.  Was treated hear for Father's Day.  It was crowded but we didn't have to wait long.  Ribs and chicken was good.  Their Brownies that are at the register are very good too.  Prices are a little...More
The Patio,https://www.tripadvisor.com/Restaurant_Review-g35712-d3598986-Reviews-The_Patio-Bridgeview_Illinois.html,"June 11, 2017",4,Good Que,This original Patio was one of my favorite spots for what I called commercial ribs. It took the place of Carson's Ribs in Chicago's Loop as a good place to go for me.  Having gone to many local Bar-B-Q places and having a family that...More
The Patio,https://www.tripadvisor.com/Restaurant_Review-g35712-d3598986-Reviews-The_Patio-Bridgeview_Illinois.html,"May 21, 2017",3,Burned ribs,Carry out dinner  ribs were used to be good but will not be ordering any more cooked and pulled pork  burger stringy  and wet bun
The Patio,https://www.tripadvisor.com/Restaurant_Review-g35712-d3598986-Reviews-The_Patio-Bridgeview_Illinois.html,"September 22, 2016",5,Tasty Cuisine at an affordable price,"Are you looking for ribs, salad, burgers, oriental food or any other specialty dish that will light up your taste buds? If so this is the place to go."
The Patio,https://www.tripadvisor.com/Restaurant_Review-g35712-d3598986-Reviews-The_Patio-Bridgeview_Illinois.html,"September 7, 2016",4,Great variety,"I've eaten here several times and it's always a treat. They offer a wide variety of food, always prepared very well."
The Patio,https://www.tripadvisor.com/Restaurant_Review-g35712-d3598986-Reviews-The_Patio-Bridgeview_Illinois.html,"September 6, 2016",3,Good. Not great. ,"So it's been about 5 years since our last visit here. We have to say unanimously that the ribs here were dry and very hard. The sauce has a great taste but if your looking for a variety of sauces, this is not your place....More"
The Patio,https://www.tripadvisor.com/Restaurant_Review-g35712-d3598986-Reviews-The_Patio-Bridgeview_Illinois.html,"August 16, 2016",4,Great Ribs,"The food is plentiful and quite tasty. It might have been the date and time we went, but it was quite noisy. Probably this is to be expected in a casual family restaurant. It will not stop me from returning since the food was great...More"
The Patio,https://www.tripadvisor.com/Restaurant_Review-g35712-d3598986-Reviews-The_Patio-Bridgeview_Illinois.html,"August 14, 2016",4,Ribs & Such,"We both love ribs and this place didn't disappoint. The salads, soups and sandwiches are very good, now offer quick, friendly service and now you've got a winner. This is one of our go to places when the Chicago Fire are playing at home."
The Patio,https://www.tripadvisor.com/Restaurant_Review-g35712-d3598986-Reviews-The_Patio-Bridgeview_Illinois.html,"July 31, 2016",5,Great salads,Went here with a bunch of teenagers. Everyone was really pleased with their meal. I had the southwest salad with chicken and it was delicious. The chicken was very tasty. We also had the Mac n cheese and my husband had the chopped salad. I...More
The Patio,https://www.tripadvisor.com/Restaurant_Review-g35712-d3598986-Reviews-The_Patio-Bridgeview_Illinois.html,"February 17, 2016",4,great value,"I go here at least every 2 or 3 weeks.  sometimes for lunch, sometimes for dinner and sometimes for carry out.  great food at a pretty good price."
The Patio,https://www.tripadvisor.com/Restaurant_Review-g35712-d3598986-Reviews-The_Patio-Bridgeview_Illinois.html,"February 8, 2016",5,"Famous for ribs, great menu overall","This family owned restaurant started small, and has expanded to many suburban locations with no diminished quality."
The Patio,https://www.tripadvisor.com/Restaurant_Review-g35712-d3598986-Reviews-The_Patio-Bridgeview_Illinois.html,"October 10, 2015",4,Classy grilled food resturant,"The restaurant is classy for such type of grilled food and burgers. I tried the Patio Burger, it was slow to be served like I waited 15 minutes but it was worth waiting it. The back area is also nice for taking picture with your...More"
The Patio,https://www.tripadvisor.com/Restaurant_Review-g35712-d3598986-Reviews-The_Patio-Bridgeview_Illinois.html,"October 3, 2015",5,The Patio,This has been a family favorite for BBQ. We always are happy with how BBQ is cooked . Meat is tender and juicy. And their sauce is very delicious. Place is cozy and staff are friendly. Minimal wait especially if you are hungry which we...More
The Patio,https://www.tripadvisor.com/Restaurant_Review-g35712-d3598986-Reviews-The_Patio-Bridgeview_Illinois.html,"June 17, 2015",4,the Patio,"On or about Tuesday, June 09, 2015, my husband and I visited the Patio restaurant.  The Patio is one of my standby restaurants, good wholesome food at reasonable prices.  I ordered the grilled salmon with grilled veggies and baked potato. Excellent and very healthy.  My...More"
The Patio,https://www.tripadvisor.com/Restaurant_Review-g35712-d3598986-Reviews-The_Patio-Bridgeview_Illinois.html,"June 3, 2015",3,All around average,Everything about this place is just....average.  Food is average. Ribs and brisket I had were nothing special.  I've had better at one of the chain restaurants.  One of my sons had a bacon cheeseburger on a pretzel bun and the other had chili dog.   I...More
The Patio,https://www.tripadvisor.com/Restaurant_Review-g35712-d3598986-Reviews-The_Patio-Bridgeview_Illinois.html,"April 17, 2015",4,terrific sauce,"I like to get the beef sandwich, then apply their barbecue sauce at the table.  It is a very tasy meal.  Only problem is that you cannot cut it into bite-size pieces with the plastic knife and fork provided.  I have learned to bring my...More"
The Patio,https://www.tripadvisor.com/Restaurant_Review-g35712-d3598986-Reviews-The_Patio-Bridgeview_Illinois.html,"April 17, 2015",5,Awesome chicken kabob,"This place is really clean. This was my second time coming to this place. The first time I just ordered sweet potato waffle fries. THIS time, I ordered the chicken kabob which was AHHHHHmazing. It was lemon herb. I ordered veggies instead of potatoes. A...More"
The Patio,https://www.tripadvisor.com/Restaurant_Review-g35712-d3598986-Reviews-The_Patio-Bridgeview_Illinois.html,"August 27, 2014",4,Good food.,"We phoned in an order for a family gathering and picked up at the drive thru; used a coupon for 15% off and got food for 8 for under $60.  The pulled pork sandwich was large and delicious, fries were good, too."
The Patio,https://www.tripadvisor.com/Restaurant_Review-g35712-d3598986-Reviews-The_Patio-Bridgeview_Illinois.html,"January 5, 2014",4,Delicious,"My wife, my daughter and I all ate here last night. I had the pulled pork sandwich and fries. The girls had rib dinners and we shared some mac and cheese. The pulled pork was awesome!! The girls thought that the ribs tasted delicious -...More"
The Patio,https://www.tripadvisor.com/Restaurant_Review-g35712-d3598986-Reviews-The_Patio-Bridgeview_Illinois.html,"July 26, 2013",3,Not bad but not great,"I got the ribs and chicken dish. Great price for a combo. Chicken was really juicy. However, the ribs were tough. The BBQ sauce didnt have a distinguished taste to me. Basically, didnt separate itself from other BBQ sauces. But overall not bad."
The Patio,https://www.tripadvisor.com/Restaurant_Review-g35712-d3598986-Reviews-The_Patio-Bridgeview_Illinois.html,"May 2, 2013",4,Great BBQ,"Love the BBQ and the new Memphis Dry is a very good change of flavor.  Would be a 5 star but they are not shy with their menu pricing.  Some things are a bit high.  With that being said, they are a model of consistency....More"
The Patio,https://www.tripadvisor.com/Restaurant_Review-g35712-d3598986-Reviews-The_Patio-Bridgeview_Illinois.html,"December 7, 2012",4,Great barbecue and more,"All of the Patio restaurants have great food and give you a good meal for the money.  I had never been to the Bridgeview Patio, but stopped after a business appointment.  The fish sandwich was excellent, and I couldn't finish it and the order of...More"
Mama Luigi's Restaurant and Banquets,https://www.tripadvisor.com/Restaurant_Review-g35712-d821565-Reviews-Mama_Luigi_s_Restaurant_and_Banquets-Bridgeview_Illinois.html,"April 7, 2021",5,Excellent,"I love this place. I make sure I go everytime I am visiting from Florida to see my aunt. The food is excellent and portion sizes great, especially the lasagna.   The waitress Bridget is the best! Sit in her section."
Mama Luigi's Restaurant and Banquets,https://www.tripadvisor.com/Restaurant_Review-g35712-d821565-Reviews-Mama_Luigi_s_Restaurant_and_Banquets-Bridgeview_Illinois.html,"January 18, 2021",5,Great Italian food,"My Wife and I frequent Mama Luigi regulary..the food is outstanding especially their specials..you won't walk out hungry as there's enough leftovers for another meal..fast service, friendly and delicious food.....Jeff and Rebecca Alter"
Mama Luigi's Restaurant and Banquets,https://www.tripadvisor.com/Restaurant_Review-g35712-d821565-Reviews-Mama_Luigi_s_Restaurant_and_Banquets-Bridgeview_Illinois.html,"February 11, 2020",5,ITALIAN FOOD  AT ITS FINIEST,I have been eating here for years.  When I have a taste for good Italian home cooking I go here.  I moved to Oak Brook and still make the drive.  I would recommend this place to everyone in need of a good Italian meal.
Mama Luigi's Restaurant and Banquets,https://www.tripadvisor.com/Restaurant_Review-g35712-d821565-Reviews-Mama_Luigi_s_Restaurant_and_Banquets-Bridgeview_Illinois.html,"January 14, 2020",5,Sunday Late Lunch,"If you like Lasagna, you have to go to Mama Luigi’s. They have the best Lasagna on the Southwest Side. Yes, you will pay $15.99 but you will take the other half home and have another meal if not two. My wife and I shall...return.More"
Mama Luigi's Restaurant and Banquets,https://www.tripadvisor.com/Restaurant_Review-g35712-d821565-Reviews-Mama_Luigi_s_Restaurant_and_Banquets-Bridgeview_Illinois.html,"October 30, 2019",5,Great lunch on a Rainy Day ,"I had the spaghetti with 2 meatballs with marinara sauce it was very good. Took half home for another meal. Also, a very good salad. My wife had the lasagna which was very high with lasagna noodles plus a very good meat sauce the bread...and coffees were excellent. We shall return.More"
Mama Luigi's Restaurant and Banquets,https://www.tripadvisor.com/Restaurant_Review-g35712-d821565-Reviews-Mama_Luigi_s_Restaurant_and_Banquets-Bridgeview_Illinois.html,"September 17, 2019",4,"Nice place, good food","I ordered the Chicken Parmesan; it was good but a little salty. The stuffed shells were great. The bread they serve while you wait is delicious! I could have made a meal out of that alone; so warm, crunchy on the outside, soft inside. Their...sangria was awesome. It’s definitely a nice family restaurant.More"
Mama Luigi's Restaurant and Banquets,https://www.tripadvisor.com/Restaurant_Review-g35712-d821565-Reviews-Mama_Luigi_s_Restaurant_and_Banquets-Bridgeview_Illinois.html,"September 17, 2019",4,Bread is excellent,"Came for a late lunch and was pleasantly surprised. Good Italian fare, the bread they serve while you wait for your food is served hot...so good! Had the chicken parmesan; it was a little salty but overall sauce had good flavor. My daughter had stuffed...shells and the taste was excellent.More"
Mama Luigi's Restaurant and Banquets,https://www.tripadvisor.com/Restaurant_Review-g35712-d821565-Reviews-Mama_Luigi_s_Restaurant_and_Banquets-Bridgeview_Illinois.html,"March 23, 2019",5,Attended a Wedding Anniversary here...,"Service - impeccable. They all smiled, were very polite and went above and beyond.   Food - delicious. We had mostaccioli, italian sausage, chicken and dressing, mashed potatoes, gravy, chicken and green beans. I did not eat the green beens, I never do anywhere. But, I...had plenty of the other stuff and it was great.   I will be going back to have more of their food. Just a great experience overall.More"
Mama Luigi's Restaurant and Banquets,https://www.tripadvisor.com/Restaurant_Review-g35712-d821565-Reviews-Mama_Luigi_s_Restaurant_and_Banquets-Bridgeview_Illinois.html,"January 2, 2019",5,Nice Find,We came here on a whim after running some errands in that area for the first time.  It was a good experience.  The server was super friendly and the food was good both in flavor and in portion size.  The bread served beforehand was definitely...fresh and warm and the salad was also good.  Overall we had a good meal and would certainly come back again when in the area.More
Mama Luigi's Restaurant and Banquets,https://www.tripadvisor.com/Restaurant_Review-g35712-d821565-Reviews-Mama_Luigi_s_Restaurant_and_Banquets-Bridgeview_Illinois.html,"December 29, 2018",3,Not as Good As I Expected,This was the first time my wife and I ate here.  It was recommended by a friend and has good reviews.  My wife's chicken marsala was good with a nicely flavored sweet marsala sauce. My linguini with white clam sauce was the worst I have...ever had. The clams were strong with a huge amount of gritty sand in each one.  I suspect they were not cleaned properly or they were a low grade.  The sauce was bland and watery. I complained to our waiter who said he would get our bill adjusted but returned saying the manager refused to take anything off saying thats the way they are. I have had this dish many times at different restaurants and that is NOT the way they should be. The minestrone soup was thin and tasteless.  Based on the manager's lack of concern and poor customer service skills (never came over to even apologize) I do not recommend this place.More
Mama Luigi's Restaurant and Banquets,https://www.tripadvisor.com/Restaurant_Review-g35712-d821565-Reviews-Mama_Luigi_s_Restaurant_and_Banquets-Bridgeview_Illinois.html,"October 2, 2018",5,Great food!,"Great food! Pasta is amazing. We have been there many times and have never been dissapointed once. The lasagna is incredible! The portions are huge and two people can share a dinner. Also, the peach sangria is very sweet and tasty. I love this place....More"
Mama Luigi's Restaurant and Banquets,https://www.tripadvisor.com/Restaurant_Review-g35712-d821565-Reviews-Mama_Luigi_s_Restaurant_and_Banquets-Bridgeview_Illinois.html,"September 24, 2018",5,professional and Friendly Staff,"We love working with Mama Luigi's Restaurant they have always delivered great service and has always accommodated our needs.  Looking forward in working in many events to come!  Thanks, Extreme Sounds Entertainment & Lighting extremesoundsent.com"
Mama Luigi's Restaurant and Banquets,https://www.tripadvisor.com/Restaurant_Review-g35712-d821565-Reviews-Mama_Luigi_s_Restaurant_and_Banquets-Bridgeview_Illinois.html,"August 6, 2018",4,Delicious Italian food just like Mama used to make!,"After several years of being away, I've had dinner here twice in the past month and found it even better than I remembered. Delicious food - large portions (which make for good leftovers) - and fast, friendly service. We'll be back for more."
Mama Luigi's Restaurant and Banquets,https://www.tripadvisor.com/Restaurant_Review-g35712-d821565-Reviews-Mama_Luigi_s_Restaurant_and_Banquets-Bridgeview_Illinois.html,"July 8, 2018",4,Just dinner ,We really like Mama Luigi's. It has been in the neighborhood for several years.  The owners take a lot of pride in the restaurant.  Check on when there is live music
Mama Luigi's Restaurant and Banquets,https://www.tripadvisor.com/Restaurant_Review-g35712-d821565-Reviews-Mama_Luigi_s_Restaurant_and_Banquets-Bridgeview_Illinois.html,"June 23, 2018",1,bad customer service,"Very rude, bad customer service unskilled management. Very bad experience. Rude and bad customer service. Jim increased quote by 25% after the banquet was reserved when asked the reason for increase became very rude. Over all a very bad experience even the manager Dominick lacked...More"
Mama Luigi's Restaurant and Banquets,https://www.tripadvisor.com/Restaurant_Review-g35712-d821565-Reviews-Mama_Luigi_s_Restaurant_and_Banquets-Bridgeview_Illinois.html,"June 9, 2018",5,Dinner before the Chicago Fire Soccer Game,Awesome!  We all enjoyed the dishes we ordered.  Plus the food was HOT ❤️❤️❤️ this so much better than warm food. The waitress was very attentive and helped us get out the door so we could catch the Chicago Fire Soccer game.  If you get...More
Mama Luigi's Restaurant and Banquets,https://www.tripadvisor.com/Restaurant_Review-g35712-d821565-Reviews-Mama_Luigi_s_Restaurant_and_Banquets-Bridgeview_Illinois.html,"April 21, 2018",5,Date Night,"Went out for dinner with my love. We decided on visiting Mama Luigi's. We were sat and the waitress promptly came by and took our drink order. When she brought or drinks, she also brought a bread basket with parmesan cheese and bruschetta.   We ordered....More"
Mama Luigi's Restaurant and Banquets,https://www.tripadvisor.com/Restaurant_Review-g35712-d821565-Reviews-Mama_Luigi_s_Restaurant_and_Banquets-Bridgeview_Illinois.html,"April 21, 2018",5,What a Pleasant Dinner,"Our son and daughter -in-law took us out for dinner yesterday.  We hadn't been in Mama Luigi's for quite  a while.  To our surprise, it was totally remodeled and beautiful.  Everything was changed.  However, the food was just as delicious and plentiful as in the...More"
Mama Luigi's Restaurant and Banquets,https://www.tripadvisor.com/Restaurant_Review-g35712-d821565-Reviews-Mama_Luigi_s_Restaurant_and_Banquets-Bridgeview_Illinois.html,"February 28, 2018",5,Delicious Lunch ,I love this place! The staff is always awesome. The owners are welcoming. They always have warm bread and bruschetta that’s to die for. If your there for a quick lunch... try the meatball sub or the steak sandwich. For dinner the chicken Parmesan or...More
Mama Luigi's Restaurant and Banquets,https://www.tripadvisor.com/Restaurant_Review-g35712-d821565-Reviews-Mama_Luigi_s_Restaurant_and_Banquets-Bridgeview_Illinois.html,"January 7, 2018",2,Horrible Chicken,"We were there for a banquet on Saturday, January 7, 2018. The room was small as there was another party in the same room but had a small 6ft divider between our party and the other. At first we were led to believe that soft...More"
Mama Luigi's Restaurant and Banquets,https://www.tripadvisor.com/Restaurant_Review-g35712-d821565-Reviews-Mama_Luigi_s_Restaurant_and_Banquets-Bridgeview_Illinois.html,"November 10, 2017",4,Mystery/dinner show,Food and service were very good.  Enjoyable evening  Bridgeview Park district sponsored the Mystery show and dinner.  Great decision.
Mama Luigi's Restaurant and Banquets,https://www.tripadvisor.com/Restaurant_Review-g35712-d821565-Reviews-Mama_Luigi_s_Restaurant_and_Banquets-Bridgeview_Illinois.html,"October 16, 2017",4,Too many good choices?,"So we're going to a soccer (futbol) game at the Toyota Stadium.  Got there early, and so wanted to find a place with good food, somewhere close.  This place is close.  I really wanted to go to a restaurant where I could get barbecue.  But...More"
Mama Luigi's Restaurant and Banquets,https://www.tripadvisor.com/Restaurant_Review-g35712-d821565-Reviews-Mama_Luigi_s_Restaurant_and_Banquets-Bridgeview_Illinois.html,"October 2, 2017",4,Good find...reccomended by a truck driver,"I usually would not follow the recommendation of a truck driver, but in this case, it was a good find.  Good food (chick parm) and very generous portions with friendly service.  Could not ask for more.  I would go back next time I am in...More"
Mama Luigi's Restaurant and Banquets,https://www.tripadvisor.com/Restaurant_Review-g35712-d821565-Reviews-Mama_Luigi_s_Restaurant_and_Banquets-Bridgeview_Illinois.html,"August 8, 2017",2,Not the best Italian restaurant,"We were celebrating a combined birthday and decided to try a new place we have never been too. We went on a Monday evening around 7:00, one of my family member notice an empty box of pampers by the garbage can the restaurant had outside...More"
Mama Luigi's Restaurant and Banquets,https://www.tripadvisor.com/Restaurant_Review-g35712-d821565-Reviews-Mama_Luigi_s_Restaurant_and_Banquets-Bridgeview_Illinois.html,"July 18, 2017",5,"Found by accident, but will return!",An accident on Harlem had traffic so backed up that we decided to get off the road and go to lunch.  Mama Luigi's was in the right place at the right time.  I am glad we pulled in there; the three of us thoroughly enjoyed...More
Mama Luigi's Restaurant and Banquets,https://www.tripadvisor.com/Restaurant_Review-g35712-d821565-Reviews-Mama_Luigi_s_Restaurant_and_Banquets-Bridgeview_Illinois.html,"April 11, 2017",5,Great service,"Great atmosphere, super service. From the host that seats you to the wait staff, very attentive to your needs. Food is excellent."
Mama Luigi's Restaurant and Banquets,https://www.tripadvisor.com/Restaurant_Review-g35712-d821565-Reviews-Mama_Luigi_s_Restaurant_and_Banquets-Bridgeview_Illinois.html,"March 30, 2017",4,Nice intimate meals.,"I always look forward to a date here with my wife of over  40 years. I could make a meal on their brochetta and crusty bread. I always manage to order a Serloin ""Cowboy Steak"" over half of which I bring home for  Steak and...More"
Mama Luigi's Restaurant and Banquets,https://www.tripadvisor.com/Restaurant_Review-g35712-d821565-Reviews-Mama_Luigi_s_Restaurant_and_Banquets-Bridgeview_Illinois.html,"March 2, 2017",5,Dinner with family,"Large selection on menu. Italian food at it's best. Reasonably priced, lunch and dinner menu. Has many of the standard items that most Italian restaurants. The food is always good and the service is friendly and quick."
