restaurant_name,link,date,rating,title,review
Al Bawadi Restaurant,https://www.tripadvisor.com/Restaurant_Review-g35712-d2243156-Reviews-Al_Bawadi_Restaurant-Bridgeview_Illinois.html,"April 11, 2021",2,"Pick-Up Order was 30 Minutes Late, Not Everyone wore masks & NO Social distancing!","Although the food was good, we were disappointed for three reasons: First, our order was 30 minutes late. The online order was confirmed for 5:45PM but was not ready until 6:15PM. Second, not everyone wore masks. Some staff and customers were not wearing masks. Third,...there was no social distancing in the restaurant.More"
Al Bawadi Restaurant,https://www.tripadvisor.com/Restaurant_Review-g35712-d2243156-Reviews-Al_Bawadi_Restaurant-Bridgeview_Illinois.html,"March 30, 2021",2,Terrible. Declined terribly,"I gave you 2 stars due to the poor service quality especially thanks to the person serving our table. His name is Anas and he was beyond terrible.  To the Management of Al Bawadi, Your food quality has declined and we drove 20 miles to...your place for bad service and terrible food.  This guy waiting our table is a piece of work - busy socializing with his friends on the next table.   When the silverware was finally brought after repeatedly asking and reminding - this guy has the audacity to give me 1 napkin and 4 forks and spoons for 4 of us - he asks me to wipe it with the napkin and pass it on to others. 1 napkin for 4 people.   I doubt we are 'EVER' coming back just because of the pathetic service that Anas rendered.More"
Al Bawadi Restaurant,https://www.tripadvisor.com/Restaurant_Review-g35712-d2243156-Reviews-Al_Bawadi_Restaurant-Bridgeview_Illinois.html,"March 23, 2021",1,Declining quality,"Albawadi's owner should be ashamed of himself for presenting an entree like this (see the pictures) and charging premium dollar for it. I ordered lamb and filet mignon and look at the pictures, I was in utter shock to even sit there when the food...was presented before me. I have been going to albawadi since 2011 and have always enjoyed their food. But this visit made me realize that, like every other business out there, these people care about their pockets rather than their loyal patrons. I understand it's a pandemic but in the food industry the quality and quantity of the food is one area WHERE YOU DON'T CUT CORNERS.More"
Al Bawadi Restaurant,https://www.tripadvisor.com/Restaurant_Review-g35712-d2243156-Reviews-Al_Bawadi_Restaurant-Bridgeview_Illinois.html,"March 20, 2021",5,Great Food and Good Service,Wanna to try different so I tried this place and the food was really good I'm surprised when I go Mediterranean I usually get Greek food but I tried something different this time pleasantly surprised.
Al Bawadi Restaurant,https://www.tripadvisor.com/Restaurant_Review-g35712-d2243156-Reviews-Al_Bawadi_Restaurant-Bridgeview_Illinois.html,"October 15, 2020",3,Poor Service,"Being the first time visiting the restaurant, we found that it has a good variety of Arabic food. However, the service wasn't professional and satisfactory which was frustrating to us. We had a situation where the waiter was unprofessional and careless with our order, so...we called the restaurant's manager to resolve our issue. Thus, I recommend the restaurant's management to improve the quality of their service.More"
Al Bawadi Restaurant,https://www.tripadvisor.com/Restaurant_Review-g35712-d2243156-Reviews-Al_Bawadi_Restaurant-Bridgeview_Illinois.html,"September 16, 2020",2,Service is ok but food is soso,Service is ok but their beef bbq is horrible. If I throw it to the wall it might break it. There grilled cheese is really goos.
Al Bawadi Restaurant,https://www.tripadvisor.com/Restaurant_Review-g35712-d2243156-Reviews-Al_Bawadi_Restaurant-Bridgeview_Illinois.html,"September 14, 2020",2,lower quality of food and service!,"Quality of service is not bad but it definitely has dropped. when we ordered the appetizers, they brought them to us at the same time as the main dinner.  Not a good idea! They used to bring complimentary Arabic coffee to the table but not...this time or even the last time.  The meat, they say the quality has not change. But I understand that now they have their own slaughter house for the lamb and beef. Its either they have a new cook or lower quality meat,  The Kabob, definitely has gristly part to it that was not removed and that made the experience very gross. I had to spit it out each time.  The Kifta Kabob was way over cooked, It was not a medium well, It was very well done, I mean over cooked, Rubbery.  The rice was cold when it came out.   I hope the service and quality of food gets better like it was when it opened . May be the covid-19 has something to do with it.More"
Al Bawadi Restaurant,https://www.tripadvisor.com/Restaurant_Review-g35712-d2243156-Reviews-Al_Bawadi_Restaurant-Bridgeview_Illinois.html,"July 15, 2020",5,Really good flavors. ,"Really good flavors. We had the toshka chicken appetizer, mixed grill and a recommended desert. More than enough for 2 people. All of it was great. The toshka chicken was really delicious, highly recommend it if you haven’t had this before. The mint lemonade was...good as well. Enjoyed the atmosphere, friendly service and music.More"
Al Bawadi Restaurant,https://www.tripadvisor.com/Restaurant_Review-g35712-d2243156-Reviews-Al_Bawadi_Restaurant-Bridgeview_Illinois.html,"January 16, 2020",5,Al Bawadi Mediterranean Grill,I Love this place  This place was highly recommended. OMG It did not disappoint. I couldn’t believe the amount of food we got for so cheap. Everything was so delicious and so much with different bursts of flavours from each dish. We had left overs...thank god 😋. Our waiter was funny and sweet.  There is a long wait time but worth it.  I think we waited 37 mins for a table. Free parking available in the lot. Family friendly. I highly recommend this place! ❤️❤️❤️ Make sure you try the labna and the cheese dish was on another level I don’t know what was in that cheese but omg it was sooooo gooooood! And the platter worth it. It comes with two different types of rice. 👌🏼  Enjoy 😉More
Al Bawadi Restaurant,https://www.tripadvisor.com/Restaurant_Review-g35712-d2243156-Reviews-Al_Bawadi_Restaurant-Bridgeview_Illinois.html,"September 29, 2019",5,Great Resturant ,"I highly recommend this restaurant with affordable price I like them, friendly staff and clean restaurant"
Al Bawadi Restaurant,https://www.tripadvisor.com/Restaurant_Review-g35712-d2243156-Reviews-Al_Bawadi_Restaurant-Bridgeview_Illinois.html,"September 21, 2019",5,Magnificent Mezze,"The flavors and textures of Al Bawadi's appetizers are in the tradition of mezze, the multiple little plates that begin a traditional Middle Eastern meal. In my many years in Beirut, I quickly learned not to fill up on hummous and baba and bread. But...More"
Al Bawadi Restaurant,https://www.tripadvisor.com/Restaurant_Review-g35712-d2243156-Reviews-Al_Bawadi_Restaurant-Bridgeview_Illinois.html,"June 8, 2019",4,Delicious Middle Eastern Food,"Food is delicious, reasonably priced, friendly staff and beautiful ambience. You must try the Arabic coffee.   Food servings are huge. Kenafa (Arabic desert) is a must for first time visitors.   I did not like the wait time. Additionally, it is awfully crowded and noisy."
Al Bawadi Restaurant,https://www.tripadvisor.com/Restaurant_Review-g35712-d2243156-Reviews-Al_Bawadi_Restaurant-Bridgeview_Illinois.html,"April 1, 2019",5,Best Mediterranean Meals!!,"We LOVE Al Bawadi!  The ambiance, the service, but mostly the food!  Everything we have tried has been amazing!  Their hummus and babaganoush is second to none.  Their shwarma and kafta are the best we have had anywhere.  And that dessert...Kanafeh...Oh My Yumminess!!! You have...More"
Al Bawadi Restaurant,https://www.tripadvisor.com/Restaurant_Review-g35712-d2243156-Reviews-Al_Bawadi_Restaurant-Bridgeview_Illinois.html,"March 22, 2019",4,Birthday Party,"Family took me out for birthday, this is a great place. The staff was friendly and knowledgeable, although our waiter had been there less than a week. He was able to suggest items with confidence and if he didn't know he found out. we had...More"
Al Bawadi Restaurant,https://www.tripadvisor.com/Restaurant_Review-g35712-d2243156-Reviews-Al_Bawadi_Restaurant-Bridgeview_Illinois.html,"February 1, 2019",5,Chicago must see place for food and fantastic atmosphere ,"Try to visit this place for past 2 years mainly because all the delicious smell of smoking meats all around the neighborhood. Finally I had a chance to and I was blown away with decor, atmosphere, service and mostly about delicious food. BIG menu offers...More"
Al Bawadi Restaurant,https://www.tripadvisor.com/Restaurant_Review-g35712-d2243156-Reviews-Al_Bawadi_Restaurant-Bridgeview_Illinois.html,"December 9, 2018",5,Delightful Mediterranean Dining,"Submerge yourself in a one of a kind experience that is a delight for all of your senses, not just your tastebuds. From great appetizers (hummus, babaganoush, arayas with cheese and of course falafel) to richly seasoned and grilled meat and fish. Amazing freshly blended...More"
Al Bawadi Restaurant,https://www.tripadvisor.com/Restaurant_Review-g35712-d2243156-Reviews-Al_Bawadi_Restaurant-Bridgeview_Illinois.html,"October 29, 2018",4,Miscommunication when making reservations,"I called to make reservations to celebrate my Mother's 89th birthday with family. We asked to be seated in the tent area and also asked if we could bring a cake to celebrate. They accepted the reservation and said yes, you can bring cake. When...More"
Al Bawadi Restaurant,https://www.tripadvisor.com/Restaurant_Review-g35712-d2243156-Reviews-Al_Bawadi_Restaurant-Bridgeview_Illinois.html,"August 27, 2018",5,Excellent Mediterranean Venue,"Starting with the Baba Ganoush sampler they provide to every table, to the uber-fresh hummus and makdous appetizers, everything is fabulous.  Tonight I ordered the Al Bawadi Seafood Mixed Grill and absolutely loved it.  The seasoned shrimp, salmon and fillet of basa were delicious.  And...More"
Al Bawadi Restaurant,https://www.tripadvisor.com/Restaurant_Review-g35712-d2243156-Reviews-Al_Bawadi_Restaurant-Bridgeview_Illinois.html,"July 29, 2018",4,Not impressed ,It was ok. I was looking for more comfy Palestinian food. The service was slow or at least our server.
Al Bawadi Restaurant,https://www.tripadvisor.com/Restaurant_Review-g35712-d2243156-Reviews-Al_Bawadi_Restaurant-Bridgeview_Illinois.html,"May 9, 2018",4,Authentic!,"The authentic vibe of this place blew us away!  The waiter was from Jordan and didn't know where Portland, Oregon was.  The food was really good, but the atmosphere was like going on a tiny vacation to Lebanon or Israel, even down to the armed...More"
Al Bawadi Restaurant,https://www.tripadvisor.com/Restaurant_Review-g35712-d2243156-Reviews-Al_Bawadi_Restaurant-Bridgeview_Illinois.html,"April 12, 2018",5,Eat the Knaffa,Just ate here with my family. Saw the guy making fresh knaffa. Had to save room for desert. The food was great! And the service was very good. Definitely recommend checking out this place.
Al Bawadi Restaurant,https://www.tripadvisor.com/Restaurant_Review-g35712-d2243156-Reviews-Al_Bawadi_Restaurant-Bridgeview_Illinois.html,"April 12, 2018",3,Captain Foodie,Although the ambience is nice the food is pretty average. The service is not at all good the staff is rude and not cooperative. They do have a service charge included in their check they still keep emphasizing on tips. They seriously need to be...More
Al Bawadi Restaurant,https://www.tripadvisor.com/Restaurant_Review-g35712-d2243156-Reviews-Al_Bawadi_Restaurant-Bridgeview_Illinois.html,"April 5, 2018",5,Great Food,"My family wanted to try something new for dinner so we decided to come here. The staff was friendly, the server Mariam, made some great recommendations for my family to try.  The food arrived quick and it tasted phenomenal. I would highly recommend it."
Al Bawadi Restaurant,https://www.tripadvisor.com/Restaurant_Review-g35712-d2243156-Reviews-Al_Bawadi_Restaurant-Bridgeview_Illinois.html,"April 1, 2018",5,Love the food ,"I went there few times and I had great service and amazing food, I would suggest everyone to go there and try it."
Al Bawadi Restaurant,https://www.tripadvisor.com/Restaurant_Review-g35712-d2243156-Reviews-Al_Bawadi_Restaurant-Bridgeview_Illinois.html,"March 11, 2018",4,Interesting Experience,"Went here with our daughter, son-in-law and two granddaughters, 11 & 9, they have dined here before, our first time.  Would not have been my choice but I knew my husband would like it and it was his birthday celebration.  I was pleasantly surprised to...More"
Al Bawadi Restaurant,https://www.tripadvisor.com/Restaurant_Review-g35712-d2243156-Reviews-Al_Bawadi_Restaurant-Bridgeview_Illinois.html,"March 3, 2018",4,Very nice,Service was very pleasant and prompt. Atmosphere nice. Spicey shrimp appetizer was excellent. Chopped salad was also very good and fresh. Lamb and ribeye cabobs were good but too well done.  Mint tea was very good.  Will go back for the dinner order of shrimp.
Al Bawadi Restaurant,https://www.tripadvisor.com/Restaurant_Review-g35712-d2243156-Reviews-Al_Bawadi_Restaurant-Bridgeview_Illinois.html,"January 23, 2018",3,Ethnic,Huge tables for families.   Unusual food choices.  Good service.  The best sweet pizza style dessert a must to try.   Many acquaintances had recommended this restaurant but you would definitely have to like this type of food.
Al Bawadi Restaurant,https://www.tripadvisor.com/Restaurant_Review-g35712-d2243156-Reviews-Al_Bawadi_Restaurant-Bridgeview_Illinois.html,"January 10, 2018",5,Fabulous dining experience.,"Outstanding experience. Entrees were excellent.  Service was informative with suggestions, and very polite.  Intend to return frequently with friends and family."
Al Bawadi Restaurant,https://www.tripadvisor.com/Restaurant_Review-g35712-d2243156-Reviews-Al_Bawadi_Restaurant-Bridgeview_Illinois.html,"November 16, 2017",5,Truly authentic and delicious ,This place is way beyond delicious and truly authentic. I come from the Middle East (Palestine/Jordan) to be specific and I know how middle eastern food tastes and this restaurant absolutely delivers . The food is really good and the service was excellent. The portions...More
Al Bawadi Restaurant,https://www.tripadvisor.com/Restaurant_Review-g35712-d2243156-Reviews-Al_Bawadi_Restaurant-Bridgeview_Illinois.html,"October 19, 2017",5,Always Good,"Went again to Al Bawadi and again it was amazing  Was visiting town for a show and went with a colleague from work.   We order the food and it was delicious. Hummus, baba ghanouj and a sample with a variety of meats and rice.  The...More"
Al Bawadi Restaurant,https://www.tripadvisor.com/Restaurant_Review-g35712-d2243156-Reviews-Al_Bawadi_Restaurant-Bridgeview_Illinois.html,"September 14, 2017",5,"good food, friendly wait staff, decent prices",we ate at Al Bawadi on Tuesday night. The food we very good & the wait staff couldn't have been more helpful & friendly!
Al Bawadi Restaurant,https://www.tripadvisor.com/Restaurant_Review-g35712-d2243156-Reviews-Al_Bawadi_Restaurant-Bridgeview_Illinois.html,"September 2, 2017",5,Best Mediterranean Grill in Chicago!,"It was a pleasant experience and good company, the food was great, to be honest, I didn't expect it to be that good, it really exceeded our expectation."
Al Bawadi Restaurant,https://www.tripadvisor.com/Restaurant_Review-g35712-d2243156-Reviews-Al_Bawadi_Restaurant-Bridgeview_Illinois.html,"August 4, 2017",5,Best restaurant ,"It is really best restaurant I've seen on Chicago. Especially for Middle East foods like Kabbab and salad. If you are planning to visit Chicago, I highly recommends that you have to stop by that restaurant and enjoy your time on it 💫💫"
Al Bawadi Restaurant,https://www.tripadvisor.com/Restaurant_Review-g35712-d2243156-Reviews-Al_Bawadi_Restaurant-Bridgeview_Illinois.html,"July 21, 2017",4,Authentic ,Stopped on our way to MI from MN. The atmosphere is nice here. I loved the authenticity here and the middle Eastern/Bedouin decor. The servers all dressed with traditional cloths and a coffee server walking around serving Arabic coffee.   We ordered the mixed grill combo...More
Al Bawadi Restaurant,https://www.tripadvisor.com/Restaurant_Review-g35712-d2243156-Reviews-Al_Bawadi_Restaurant-Bridgeview_Illinois.html,"July 19, 2017",4,Tasty Arabic Food,"We had the mixed platter (humus, mutabal and falafel) for the starter and I had the Tabouleh for the main dish while my friend's had rice and meat. All the food was great and so was the service (the ladies were very professional and helpful)....More"
Al Bawadi Restaurant,https://www.tripadvisor.com/Restaurant_Review-g35712-d2243156-Reviews-Al_Bawadi_Restaurant-Bridgeview_Illinois.html,"July 11, 2017",5,Fantastic and one of a kind,"The food was fantastic, The mood was superb, if you're into international experience this is the place for you"
Al Bawadi Restaurant,https://www.tripadvisor.com/Restaurant_Review-g35712-d2243156-Reviews-Al_Bawadi_Restaurant-Bridgeview_Illinois.html,"July 3, 2017",5,Best place to eat Middle Eastern food,"Every single thing we have had at Al Bawadi has been amazing - best hummus, baba ghanouj I have ever had. The muthawama is a revelation. Even the vegetarians on our group could not resist the meat and seafood dishes."
Al Bawadi Restaurant,https://www.tripadvisor.com/Restaurant_Review-g35712-d2243156-Reviews-Al_Bawadi_Restaurant-Bridgeview_Illinois.html,"June 2, 2017",5,Great food ,"This place had delicious food in every bite I enjoyed everything, am very critical about eating out specially Mediterranean food , and as a gourmet cook myself i can say the food is perfect from the appetizer to the fattosh salad and the grilled kebab...More"
Al Bawadi Restaurant,https://www.tripadvisor.com/Restaurant_Review-g35712-d2243156-Reviews-Al_Bawadi_Restaurant-Bridgeview_Illinois.html,"May 20, 2017",5,Best place to eat Middle Eastern food,I felt  in love with this restaurant!  The food is delicious  and not expensive. We order for 6 people and we got like for 12.  The staff is very kind. You feel like in Middle East. Nice and clean. Well located
Al Bawadi Restaurant,https://www.tripadvisor.com/Restaurant_Review-g35712-d2243156-Reviews-Al_Bawadi_Restaurant-Bridgeview_Illinois.html,"May 4, 2017",5,Great food,Food was great and so was the service. Love the outfits the servers were wearing.  Made the experience more authentic
Al Bawadi Restaurant,https://www.tripadvisor.com/Restaurant_Review-g35712-d2243156-Reviews-Al_Bawadi_Restaurant-Bridgeview_Illinois.html,"April 12, 2017",5,100% Recommended ,One of the best middle eastern restaurants I have ever been too. I would recommend all folks to eat here once. All is halal. ;)
Al Bawadi Restaurant,https://www.tripadvisor.com/Restaurant_Review-g35712-d2243156-Reviews-Al_Bawadi_Restaurant-Bridgeview_Illinois.html,"April 10, 2017",5,Heaven on a plate ,Omg this was literally some of the best food I have ever had and I know Arab food. We ate here twice during our stay in Chicago. If we lived closer we would eat here every single day. I wish they had one where we...More
Al Bawadi Restaurant,https://www.tripadvisor.com/Restaurant_Review-g35712-d2243156-Reviews-Al_Bawadi_Restaurant-Bridgeview_Illinois.html,"March 24, 2017",5,Best in the world,"Everything about this place is great. We usually eat in or take out and it's always great. If you're dining there, order the mixed grill tray. Comes with more than you can handle for 4-5 persons including fatoush (Arabic salad), bread, hummus, and mixed pickles....More"
Al Bawadi Restaurant,https://www.tripadvisor.com/Restaurant_Review-g35712-d2243156-Reviews-Al_Bawadi_Restaurant-Bridgeview_Illinois.html,"March 22, 2017",5,It's one of the very best Middle Eastern food in the US,"As a guy who knows how Middle Eastern tastes, this is by far is one of the best middle eastern food I've tried within the USA. I went to Chicago for three nights and we had all our dinners there. Abo Fars the owners is...More"
Al Bawadi Restaurant,https://www.tripadvisor.com/Restaurant_Review-g35712-d2243156-Reviews-Al_Bawadi_Restaurant-Bridgeview_Illinois.html,"January 18, 2017",4,Great place,"To me middle eastern food is all about that killer combination of pita bread, smeared on the inside with either, hummus or even better garlic sauce and filled with a combination of meat and tabbouleh salad. This place has some amazing garlic sauce and grilled...More"
Al Bawadi Restaurant,https://www.tripadvisor.com/Restaurant_Review-g35712-d2243156-Reviews-Al_Bawadi_Restaurant-Bridgeview_Illinois.html,"January 11, 2017",5,Top 5 Mediterranean Food,"Located west of chicago in suburbs great mediterranean restaurant i been going here once in 2 months great food, great environment must try their Lamb shish kebab. They also have some fresh squeezed juice and great mint tea."
Al Bawadi Restaurant,https://www.tripadvisor.com/Restaurant_Review-g35712-d2243156-Reviews-Al_Bawadi_Restaurant-Bridgeview_Illinois.html,"January 7, 2017",5,Best dinner night,"This is an amazing Restuarant, offers authentic Mediterranean Lebanese cuisine.   Tip: order food with caution. The servings are too large for two - three people."
Al Bawadi Restaurant,https://www.tripadvisor.com/Restaurant_Review-g35712-d2243156-Reviews-Al_Bawadi_Restaurant-Bridgeview_Illinois.html,"September 7, 2016",4,Good Middle Eastern Food,"Mezze are really really good. Hummus is thick and creamy, baba ghannoush is good and garlicky, and the toum, a whipped garlic dip, is phenominal. Kabobs are usually cooked well, but juicy and flavorful. Sandwiches are pretty good too. Only thing is they have plighty...More"
Al Bawadi Restaurant,https://www.tripadvisor.com/Restaurant_Review-g35712-d2243156-Reviews-Al_Bawadi_Restaurant-Bridgeview_Illinois.html,"August 1, 2016",1,Worst Service and Overcharged,"I have been to this place twice before and found a serious issue with there service , a very rude Manager who was not listening. We ordered a two of the the main platters which used to include Lamb chops and Quail which they took...More"
Al Bawadi Restaurant,https://www.tripadvisor.com/Restaurant_Review-g35712-d2243156-Reviews-Al_Bawadi_Restaurant-Bridgeview_Illinois.html,"July 26, 2016",4,Real deal Middle Eastern,"Authentic, tasty and great atmosphere.  I will most certainly return. Also the staff made suggestions and cared that we had an excellent meal and time."
Al Bawadi Restaurant,https://www.tripadvisor.com/Restaurant_Review-g35712-d2243156-Reviews-Al_Bawadi_Restaurant-Bridgeview_Illinois.html,"July 24, 2016",5,"felt like I was in Arab world, minus the problems of 3rd world countries....","Very tasty food (had the hummus/bread, baba ghanouj, and the big platter that feeds like 10 people with kabobs, chicken, lamb, 2 types of rice, and the big flaky thin bread, I forget its name).     Our waiter was friendly and prompt.  Awesome loud ethnic Arab...More"
Al Bawadi Restaurant,https://www.tripadvisor.com/Restaurant_Review-g35712-d2243156-Reviews-Al_Bawadi_Restaurant-Bridgeview_Illinois.html,"July 15, 2016",1,Very disappointed ,"My husband and I went to Al Bawadi restaurant last night and we were very disappointed. First, we were given a small table and the chairs were uncomfortable. Second, I told the waitress I wanted a small house salad and baba ghanooj with the mixed...More"
Al Bawadi Restaurant,https://www.tripadvisor.com/Restaurant_Review-g35712-d2243156-Reviews-Al_Bawadi_Restaurant-Bridgeview_Illinois.html,"June 15, 2016",5,Really good place to eat at ,My family and I went to this place a couple of weeks ago and the food was outstanding. Really love the way everything is set up it makes it seem like you are actually in Palestine. Really recommend it.
Al Bawadi Restaurant,https://www.tripadvisor.com/Restaurant_Review-g35712-d2243156-Reviews-Al_Bawadi_Restaurant-Bridgeview_Illinois.html,"May 22, 2016",3,GOOD MEDITERRANEAN FOOD EXPERIENCE,"I tried this restaurant twice before going across the street to The Nile. Al Bawadi has greater ambiance, costume and display of food. Regardless, the quality and preparation is on a par with some of the big restaurants I visited in Haifa and Ramallah.  The...More"
Al Bawadi Restaurant,https://www.tripadvisor.com/Restaurant_Review-g35712-d2243156-Reviews-Al_Bawadi_Restaurant-Bridgeview_Illinois.html,"April 6, 2016",1,Read your Receipt Carefully before you pay,"We are from Different state, We came to Chicago for fun,  and based on family Recommendations we give this place a visit, The only adult was me and my wife and 6 children all of them less than 9 years old, they sat us very...More"
Al Bawadi Restaurant,https://www.tripadvisor.com/Restaurant_Review-g35712-d2243156-Reviews-Al_Bawadi_Restaurant-Bridgeview_Illinois.html,"March 21, 2016",5,Very Good Food,"They served really tasty and authentic Arabic food. Good size portions, clean restaurant, good menu, very helpful staff."
Al Bawadi Restaurant,https://www.tripadvisor.com/Restaurant_Review-g35712-d2243156-Reviews-Al_Bawadi_Restaurant-Bridgeview_Illinois.html,"March 5, 2016",5,Great food,This place is always very busy. They serve delicious middle east food. I mostly eat kebab there and love it. They have good appetizers also. But you should know that the place most of the is very crowded and loud. So not a romantic place...More
Al Bawadi Restaurant,https://www.tripadvisor.com/Restaurant_Review-g35712-d2243156-Reviews-Al_Bawadi_Restaurant-Bridgeview_Illinois.html,"February 6, 2016",4,"Delicious, fresh food with bold Mediterranean flavor",My husband and I went here for a little lunch date during the week. It wasn't crowded but there was a steady flow of customers eating and taking food to go. The food was delicious! The appetizers were great. The salad was different than traditional...More
