restaurant_name,link,date,rating,review,user,user_id,review_id,order_type
Flo & Santos,https://www.zomato.com/chicago/flo-santos-south-loop/reviews,"Jun 22, 2012",4.5,Great Polish classics. Needed a post-travel snack after arriving at the Hilton during my first visit to Chicago. Wanted pierogies so took a quick walk here. So glad I did. Good cheese and kraut & mushroom pierogies.. Was happy to see a great selection of Polish beer and vodkas and had Zubrowka with apple juice at the bar. Great atmosphere and attentive service. Will definitely be back.,Flighty,22401453,16167844,DINING
Flo & Santos,https://www.zomato.com/chicago/flo-santos-south-loop/reviews,"Jun 22, 2014",1,"Sketchy Bartender. The bartender failed to bring back my change two times in a row until I asked which was awkward. Won't be back.   -----12 May, 2012-----  The sauce didn't taste fresh and was far too sweet, and the cheese was rubbery and tasteless. I'll be looking elsewhere for pizza next time I'm in the south loop.",Tmoney,20602489,16167841,DINING
Flo & Santos,https://www.zomato.com/chicago/flo-santos-south-loop/reviews,"Mar 23, 2012",4.5,Pork wings.....Yes please. Pizza was good. they have a good variety of ingredients including polish saw-siege. The highlight was the pork wings....That's right deep fried ribs!,Chef Standstill,21643225,16167838,DINING
Flo & Santos,https://www.zomato.com/chicago/flo-santos-south-loop/reviews,"Aug 02, 2011",4.5,Killer apps and decent pizza. Go there for the apps!!! The Asian ribs are delicious as well as the onion with camp fire sauce. The pizza was average for the city. I like the casual atmosphere there,MISSAYO,21628644,16167835,DINING
Flo & Santos,https://www.zomato.com/chicago/flo-santos-south-loop/reviews,"Jul 12, 2011",2,"OK & So So. The service was great, very attentive staff. The pizza was undercooked, soggy, and bare. The italian sausage had a good taste, but the sauce was something I remembering eating in a my grade school cafeteria. I will give it another chance in the future. They have some decent beer specials throughout the week",Kent,21968857,16167832,DINING
Flo & Santos,https://www.zomato.com/chicago/flo-santos-south-loop/reviews,"Jun 26, 2011",0,Love the local atmosphere. Friendly staff and the specials are good. Good food for the value.,Smith,22075109,16167829,DINING
Flo & Santos,https://www.zomato.com/chicago/flo-santos-south-loop/reviews,"Jun 15, 2011",4.5,"Glad We Came. We were spending the day in Chicago and walked over from the Field Museum for a late lunch after seeing the positive reviews and ratings on UrbanSpoon. Very glad we did. The server/bartender was pleasant and efficient. The place was mostly empty, however, our food still came out ridiculously fast. The meatball sandwich and italian beef sandwich were very, very good, and the portion was generous. This is definitely a place we'll remember for the next time we're in Chicago.",Luvlocaleats,21397962,16167826,DINING
Flo & Santos,https://www.zomato.com/chicago/flo-santos-south-loop/reviews,"Feb 04, 2011",4.5,Just had a burger and it was great. I never even out any condiments on it and it tasted awesome. The pretzel bun is a serious upgrade to the burgers. Can't wait to try the other sandwiches and to try some of the imteresting style pizzas. The waffle fries are a plus.,Uncle Pete,21228894,16167823,DINING
Flo & Santos,https://www.zomato.com/chicago/flo-santos-south-loop/reviews,"Sep 29, 2010",4.5,Great neighborhood bar & grill. Great servers! Food was very good. I've since returned to my home (not Chicago) and all I think about is PORK WINGS!!!! Holy cow those things rock!!!!! I'll be back in Chicago next month and I'll be bringing them back!,S. Johnson,21516998,16167820,DINING
Flo & Santos,https://www.zomato.com/chicago/flo-santos-south-loop/reviews,"Aug 04, 2010",4.5,"Loved the Polish sampler. Good, homemade food! They also have thin crust pizza - homeade sausage is excellent. I had a taste only, as I had the Polish sampler. Ask for a side of horseradish on the side tho - makes the flavors pop. Friendly, casual atmosphere - 5 tv's so you an watch sports if you want. Decent beer menu as well.",Paula Morgan Chapman,21449771,16167817,DINING
Flo & Santos,https://www.zomato.com/chicago/flo-santos-south-loop/reviews,"Nov 17, 2012",4.5,"When searching for new pizza places in Chicago, I stumbled across Flo and Santos... a pizza place that specializes in Thin Crust pizza rather than the traditional deep dish.  They offer so many specialty creations that remind you of random food items from buffalo chicken sandwiches to the italian beef classic. ",EatingForSanity,22812298,11035321,DINING
La Cantina Grill,https://www.zomato.com/chicago/la-cantina-grill-south-loop/reviews,"Aug 05, 2019",4,"First off keep in mind that this place gets slammed due to its proximity to McCormick Place, Soldier Field and Wintrust so plan accordingly. We tried twice before we didn't have to wait an hour, settling for lunch on Saturday. Still busy. After waiting for ten minutes we asked for water. Then chips and salsa. Then place settings. We noticed lots of half-eaten dinners being cleared away. We eat a lot of Mexican food and this was as good as our standard places. Good flavor salsa. Large portion of ceviche (we added the shrimp which is extra). My Chile rellenos were hot and perfectly breaded with evenly melted cheese (I'm a little obsessed with my Chile relleno prep) and my husband's Pollo Verde had nicely balanced flavor with a little spicy kick. We waited for the check, finally asking and our server disappeared with the credit card. After 15 minutes we asked the host about it and he scurried around, found the tab and credit card lying somewhere and apologized. I guess the extra crowds from Taylor Swift concert and the ASCO conference affected our waiter's concentration. We will go back. Maybe on a weekday!",Harshit Oberoi,123583792,44359454,DINING
La Cantina Grill,https://www.zomato.com/chicago/la-cantina-grill-south-loop/reviews,"Aug 28, 2018",4,We opted for this place because it was one of the closest restaurants to our hotel. We were so glad we chose it.  The had great Mexican food. The portions were huge. They have a lot of choices on the menu.  It's very loud and the place is small so be prepared for that if you go.,Vickrahm Kohli,50139871,38694567,DINING
La Cantina Grill,https://www.zomato.com/chicago/la-cantina-grill-south-loop/reviews,"May 03, 2018",4,So I haven't been there yet. But I ordered in Mini Chimichangas which were delicious with a varied range of accompaniments.  I'm a big fan of Fried Ice Cream and this place serves it amazing. Must try!   The chicken quesadilla is a good bet too!  Decent Price Range!,Antara,11400061,35045126,DINING
La Cantina Grill,https://www.zomato.com/chicago/la-cantina-grill-south-loop/reviews,"Mar 11, 2018",1,"Entry level Mexican , large portions very noise can’t here anyone talk , food tasteless and a sad eating experience best left to those wanting to mass carbo load ",G,40659410,33904078,DINING
La Cantina Grill,https://www.zomato.com/chicago/la-cantina-grill-south-loop/reviews,"Feb 08, 2018",4.5,"Great big place, big lines, but plenty of tables. You order at counter, pick up at another counter, then find a table. Serving beer and wine. Food was comfortable and they had an extensive menu. Been in business many, many years, but still popular.",Rajiv Sinha,37948337,33461699,DINING
La Cantina Grill,https://www.zomato.com/chicago/la-cantina-grill-south-loop/reviews,"Apr 07, 2014",0,"Mexican food lover. I purchased a chicken burrito meal to go. Right off the bat, i thought it was pricey ($13.95). The rice and beans portions were small. They only filled half the compartment of the take out tray. The burrito was bland. It had no seasoning, no flavor, very little taste. There was no lettuce and very little tomatoes. I cannot recommend this dinner and will not go there again. Bottomline - overpriced and blah food. The restaurant would be a wonderful place for a date. It's very dark and cozy. So i would suggest going there for a date, have a few margueritas, don't buy the food. For good mexican food, try blue Agave on w maple st, chicago.",Queenivy99,24477143,16101649,DINING
La Cantina Grill,https://www.zomato.com/chicago/la-cantina-grill-south-loop/reviews,"Nov 11, 2013",0,"Omg. What a dissappointment!!! I went there for my girlfriends birthday, because its close to the house and it was sunday. The server was very rude, and overcharged 2 dollars more than the menu price. They never ask if my girlfriend if she wanted a refill of her water. I intended on getting desert, but was never asked or approached. The shrimp was not appetizing, everything tasted wierd (maybe because tex mex). But I do like taco johns. Overall we will NEVER GO BACK. I felt soo bad. It was my girlfriends birthday, and we were even too disgusted to even finish our food. I would recommend stay away.",Jay,24160926,16101646,DINING
La Cantina Grill,https://www.zomato.com/chicago/la-cantina-grill-south-loop/reviews,"Feb 15, 2012",0,"Horrible Exerience all Around. The highlight of this meal was that we had a groupon and did not pay full price. My fiance and I went yesterday and it being Valentine's Day we called ahead last week to see if we needed reservations. Erica told us no we did not but when we got there at 6:30 last night, yes you did. ""Luckily"" for us we only had to wait about 5-10 minutes for a table. We ordered our margaritas and guacamole and they brought us the standard chips and salsa. While the margarita's were quite big for the price I'm still trying to find the tequila in mine. The chips, salsa and guac, I will say, were pretty good. We ordered our entree's and about 15 minutes later they brought my full fajita dinner out and then the waitress giggles and says I'm sorry I forgot to push the button on yours (to my fiance) it will be right out....what we learned about 15-20 minutes later was she didnt put his order in at all. So here we sit with my food in front of me and nothing for him. I find it rude to eat when my date has nothing so I didn't touch my food. Naturally when they brought his and we began to eat, mine was already cold. The saving grace in that was it had zero taste so it really wouldn't have mattered if it was warm or not. To make up for the error the waitress offers us a complimentary dessert. Which I thought was nice, however, it took another 20 minutes to get a scoop of vanilla ice cream and hard, tasteless churros (a dessert she recommended to us). We got no refills or offers for refills for our cocktails and we had to practically tackle the bus boy for more water. This restaurant would have gotten zero stars if not for the groupon and the waitresses attempt to make up for the poor service. Two and half hours were wasted in this restaurant and needless to say we will not be going back.",Angelina,22624490,16101643,DINING
La Cantina Grill,https://www.zomato.com/chicago/la-cantina-grill-south-loop/reviews,"Oct 05, 2011",4.5,"Good food, decent service. You must have the Queso Fundido. It was great. The guacamole was decent, and the salsa was pretty good. The sopapilla was actually just chips, which I found strange.   Overall though, the food was excellent, even though the service was a little slow and not great.",Julie Hassenflug Daniels,22224833,16101640,DINING
La Cantina Grill,https://www.zomato.com/chicago/la-cantina-grill-south-loop/reviews,"Aug 06, 2011",4.5,"Chips and salsa to start were above average, good flavor for sure. Got the mini chimis as an appetizer and definitely did not regret it. Pico de gallo was fresh and tasty. My friend got the enchiladas lunch and I got the chicken burrito. Both were good quality Mexican meals that won't leave you hungry. Atmosphere was very clean and friendly, just an overall solid Mexican restaurant that I would recommend to anyone in the area looking for a reasonably priced good quality Mexican meal.",Danger,22173008,16101637,DINING
La Cantina Grill,https://www.zomato.com/chicago/la-cantina-grill-south-loop/reviews,"May 16, 2010",4.5,"Great authentic food and good service. Fresh chips and medium/mild salsa are complimentary firsts, the appetizer sampler fed 2 of us for $10 and had tacitos, chimichungas, chips and cheese and mire, Domestic beers were around $4. The Horchata was perfectly cool and refreshing with great sweet flavor",Teresa Hendricks,20928411,16101634,DINING
La Cantina Grill,https://www.zomato.com/chicago/la-cantina-grill-south-loop/reviews,"Oct 15, 2009",4.5,"! Holy Mole' !. 7-2-09 Hola, everyone! Yesterday the Loopers ventured to La Cantina, a small Mexican restaurant in the South Loop. We were seated right away and had good service throughout our lunch. It was a special lunch for us, as it commemorated our first anniversary of Looping! We sampled the taco salad, chile rellenos, steak fajitas and vegetarian burrito. Everything got great reviews, except the steak fajitas, which were just ok. The chile rellenos had an exceptionally nice presentation. It should be noted that the taco salad, when ordered without meat, comes with several surprise grilled veggies, in addition to the standard rice/beans/lettuce/guac/cheese. We all LOVED the chips and salsa that came complimentary with our meals. We just may go back for more, along with some margaritas to wash them down. Ole'!",Lunch In The Loopers,20866921,16101631,DINING
La Cantina Grill,https://www.zomato.com/chicago/la-cantina-grill-south-loop/reviews,"Jul 12, 2009",4.5,I read the reviews on this place and the high praise given to the drinks made my husband and I try it. The drinks were good but so was the food. It reminded us of the great food we had on our honeymoon in Mexico. I would highly recommend this place!,Cassandra,20964857,16101628,DINING
La Cantina Grill,https://www.zomato.com/chicago/la-cantina-grill-south-loop/reviews,"Jun 03, 2009",4.5,"Lunch portions generous, fresh burritos. I quite enjoyed the food here -- fresh nachos were brought to the table, and my burrito was filled with lettuce and tomatoes in addition to chicken and sour cream.  It was nice to have a refreshing burrito instead of those crappy ones you sometimes get that don't have a single vegetable in them.  Overall, great food. But if the lunch portions were that big, I'd be scared to see the regular portions...",Meredi,20603872,16101625,DINING
La Cantina Grill,https://www.zomato.com/chicago/la-cantina-grill-south-loop/reviews,"Apr 13, 2009",4.5,Americanized tex Mex. There were drink specials that the bar tender never mentioned but the drinks were good,Ariel E Neal,20843926,16101622,DINING
La Cantina Grill,https://www.zomato.com/chicago/la-cantina-grill-south-loop/reviews,"Sep 12, 2008",0,"Great restaurant!. This is an excellent example of what a mexican restaurant should be.  i read the reviews because i heard about this place and wanted to see what people were saying.  i'm glad i went despite the reviews.  i had the opportunity to actually go ""back stage"" yes in the kitchen to see for myself.  the owner was so nice to take me back after we had a nice conversation about the reviews i read.  the myths about ""canned and frozen"" are just that, myths.  everything is made to order, except for the wings and the fries, everything is fresh, everything.  the kitchen is not that big, they only have one freezer, they smash the beans by hand, cut the meat and vegetables, pack the tamales, smash the avocados for guac all by hand, it's amazing.  i was very surprised.  i've worked in restaurants and none of them did it like they do.  the place is clean and the people are very nice.  then i ate, and the food is fantastic.  i read a lot of people saying ""it's bland"", yeah i see what you mean but the problem is that the other places are actually over seasoned and too salty, if you've tasted true mexican food you would know what they're offering, as far as i'm concerned, this restaurant takes the prize.  it is a place to eat.",Karen Jp,20639041,16101619,DINING
La Cantina Grill,https://www.zomato.com/chicago/la-cantina-grill-south-loop/reviews,"Apr 07, 2008",4.5,"FOOD & SERVICE EXCELLENT, A NICE RESTAURANT. I think the last review is nuts, maybe he's used to tex mex, or maybe he has never even been to la cantina. i have actually been there 4-5 times and love it. i have seen their kitchen and i have seen them making the beans from scratch and their salsa is probably one of the best i've had. i actually like the place so much that i was just checking it out online, and when i saw that review, it really bothered me. the place is small, how can the waitress ignore someone for 10 minutes. come on, it's not right to give bogus reviews. expensive? i think it's cheap 6-7 bucks for a huge margarita, down town, or 9-10 dollars for a meal, thats not expensive.",James L.,20610269,16101616,DINING
La Cantina Grill,https://www.zomato.com/chicago/la-cantina-grill-south-loop/reviews,"Mar 14, 2008",2,"Consider Another Option. I'm visiting Chicago from the Gulf Coast and Thursday night is always Mexican night. La Cantina was one of the few mexican restaurants in the South Loop area where I was staying so I decided to give it a try. What a disappointment.   To start there were only 10 people in the place and it took the waitress 10 minutes to acknowledge me. The chips were thick, hard, burned,. and luke cold and the salsa was snot green. I ordered a frozen lime margarita, a chicken chimichanga with spanish rice and refired beans. The margarita was the only thing worth consuming. It was average but overpriced ($6.95 for a small). The chimichanga had a thick crust and was dark brown. They brought out a steak knife with it and after trying to cut into the chimi with a fork I figured out why they brought the knife. The chicken inside had been grilled and it was very very dry. I could have gotten over the dry chicken if the chimi had any taste at all but it was bland and tasteless. The beans looked and tasted like they came out of a can and the spanish rice had to be Uncle Bens. I am not normally one to write a bad review of anything but... $24 for dinner w/ tip and another $10 for a cab. Way too much to pay for bad food.   Maybe I'm spoiled by the authentic mexican food that we have in the Deep South but I'm used to warm crispy chips, fresh red salsa with a little kick, hot queso cheese dip, a chimichanga with a flaky crush that you can easliy cut with a fork that reveals tender chicken seasoned just right, beans that have actually been refried, and homemade spanish rice.",Hilton,20609486,16101613,DINING
Chicago Waffles,https://www.zomato.com/chicago/waffles-south-loop/reviews,"Feb 08, 2018",4,"I'm not at all into fast food, but after a couple of drinks in a Blues Club, craving for just a little bite, the idea of a Hot dog and fries, sounded good to me and Portillo's delivered. In a Disneyland like styled ambience the quick grub just hit the spot.",Rajiv Sinha,37948337,33461659,DINING
Chicago Waffles,https://www.zomato.com/chicago/waffles-south-loop/reviews,"May 31, 2017",3.5,"This breakfast place has one of the best waffles around downtown that are way too delicious. Other breakfast dishes are good too but the waffles are a must try.  Recommendation- red velvet waffles served with strawberries, strawberry cream, walnuts and maple syrup ",Malika Chopra,2540878,30539515,DINING
Chicago Waffles,https://www.zomato.com/chicago/waffles-south-loop/reviews,"Dec 18, 2016",3.5,Great stuff... Must try.. try their pancakes .. waffle with ice creams...  Apart from these I tired there buffalo chicken ..and it was average. It tasted salty. The wings were done perfect the buffalo sauce was nice just the salt in food was let down.   Over all a nice place to be. ,Boom_0.0 (Sourabh Taluja),254965,28978966,DINING
Chicago Waffles,https://www.zomato.com/chicago/waffles-south-loop/reviews,"Jan 24, 2016",4,"I've been here three times in my twenty days in Chicago so yes, that's clearly an indication that I liked the food very much! Generous servings, tasty meals and so inexpensive. 😊 The only thing that was not good for me was during our first visit, the whole plate was too spicy for the kids (we had the 3.99 bacon chicken waffle)... and we had to order a new one. ",Angeli David,29160086,26092649,DINING
Chicago Waffles,https://www.zomato.com/chicago/waffles-south-loop/reviews,"Sep 13, 2014",3.5,"What's not to like about Waffles. Called in here yesterday for a weekday brunch. No issue getting a seat and staff are delightful. First tick was that they have freshly squeezed orange juice. I tried their waffle flight, a sample of 4 waffles. The red velvet was my favourite.   The person next to me had the waffles with pork, poached eggs and hollandaise sauce. Very generous serve and I was ensured was delicious.",Belly Rumbles,21403693,16177078,DINING
Chicago Waffles,https://www.zomato.com/chicago/waffles-south-loop/reviews,"Nov 17, 2013",0,Not impressed. Just ate here at waffles with and outside of not having to wait for a seat there is absolutely nothing to rave about. Midiocracy at most. and over priced. Don't waste your time#,Marebe123,24170254,16177072,DINING
Chicago Waffles,https://www.zomato.com/chicago/waffles-south-loop/reviews,"Sep 27, 2013",4.5,"This place is phenomenal. I highly recommend it. The various types of waffles you can get is amazing. Not many places have so much choices of types of waffles. If you are a fan of multiple items then try the waffle flight. It is smaller portioned, however. I highly recommend the green tea waffle. Also the Mexican chocolate waffle is tasty. Pricey, but worth it.",Nikki Luczak,24088451,16177069,DINING
Chicago Waffles,https://www.zomato.com/chicago/waffles-south-loop/reviews,"Jun 23, 2013",2,"Not the best pancakes or waffles we've ever had, but we'd come back to try other items ( the bacon saved the day)",CAF,22368046,16177066,DINING
Chicago Waffles,https://www.zomato.com/chicago/waffles-south-loop/reviews,"Aug 31, 2012",0,"I agree with previous reviewers, the service is very slow and very interesting menu. The wait staff could be a little more tentative and more organise. I wait 30 min to place my order and another 45 to get my order. The meal was good but not worth the wait.",Angelie Murphy,21834960,16177063,DINING
Chicago Waffles,https://www.zomato.com/chicago/waffles-south-loop/reviews,"Jun 21, 2012",2,"Not for those in a hurry. Had breakfast here with my wife and mother and we were pleasantly surprised to find there wasn’t a wait when we arrived early on a Saturday morning. We looked over the menu, placed our order and then spent the better part of 40 minutes waiting for our food to arrive at the table. Our waitress seemed completely oblivious to the length of our wait and seemed genuinely perplexed when we asked her if the long wait was normal. Much to our chagrin, when the food arrived at the table my wife's vegetable scramble was lukewarm, my waffle sampler was a mixed bag, and my mother was too annoyed by the wait to give a fair assessment of her meal. I thought the Red Velvet waffle was too sweet and the Liege waffle was as crispy as advertised. The Mexican chocolate, and the green tea waffles almost made the long wait and inattentive service worth bearing. The potatoes were nice and crispy, just as I like them and they paired well with the scramble. As far as South Loop breakfast spots go I would have to say Waffles is in the bottom half of the available options.",Alex,22912623,16177060,DINING
Chicago Waffles,https://www.zomato.com/chicago/waffles-south-loop/reviews,"Apr 13, 2012",4.5,"Tasty Waffles. Delicious breakfast and very unique menu. Try the green tea waffle!! Absolutely delicious. Service was a little slow but other than that, very good!",Laura,22669277,16177057,DINING
Chicago Waffles,https://www.zomato.com/chicago/waffles-south-loop/reviews,"Aug 29, 2013",0,"Posted on March 13, 2013 by The Lu Life Waffles on S. Michigan Avenue in Chicago has received reviews on the “not so appetizing” end.  However, I couldn’t believe that the place is THAT bad since they just opened a second location in Lakeview at the end of last year!  Well, Andrew and I were finally able to sample the food after a long 45 minute wait, and this is what we thought: Figure 1. Hot Chocolate To drink, I wanted to start out with a hot chocolate (Figure 1) to warm me up.  Unfortunately, this was a complete façade of enticing whipped cream that hid a cup of watered down, lukewarm hot chocolate.  In addition, Andrew’s cappuccino was lacking in a major component: the coffee.  A cup of warm milk certainly did not work any wonders. Figure 2. Chili We also ordered a bowl of chili (Figure 2), which was hands down the worst chili I’ve ever had (and I’ve had my share).  It was so watered down, and only half the bowl had solid ingredients.  Absolutely unappetizing. Figure 3. Chicken an",Lu Yao,23699840,11494438,DINING
Chicago Waffles,https://www.zomato.com/chicago/waffles-south-loop/reviews,"Jul 30, 2013",0,"They serve a variety of creative waffle dishes with big potential, but I wasn’t blown away. For a quick morning bite when we don’t want to travel far from the neighborhood? Sure. An outstanding brunch spot to take friends? Not so much.  waffleschicago.com ",A Fare Affair,22506363,11130568,DINING
