restaurant_name,link,date,rating,review,user,user_id,review_id,order_type
Mario's Italian Lemonade,https://www.zomato.com/chicago/marios-italian-lemonade-university-village/reviews,"Jul 08, 2013",0,"In Little Italy, Mario's Italian Lemonade is one of the places that helps create that special identity. Mario's Italian Lemonade is a throwback. It's a small Italian ice shop with nothing fancy. ",David Aldridge,21307611,11298988,DINING
Mario's Italian Lemonade,https://www.zomato.com/chicago/marios-italian-lemonade-university-village/reviews,"Aug 19, 2013",4.5,"Once the weather warms up, Chicagoans start flocking towards the Little Italy establishment known as Mario's Italian Lemonade.  This small frozen lemonade stand is only open for a few months each year, but attracts hundreds of customers each day.  ",EatingForSanity,22812298,11035972,DINING
Mario's Italian Lemonade,https://www.zomato.com/chicago/marios-italian-lemonade-university-village/reviews,"May 25, 2012",4.5,"summer is especially good as mario's italian lemonade stand is across the street and open from may to september (since 1954).  a cool, refreshing slightly sour lemon ice (other flavors and treats too) is a great way to finish any meal!",Fourfried.com,22762375,10975366,DINING
Mario's Italian Lemonade,https://www.zomato.com/chicago/marios-italian-lemonade-university-village/reviews,"May 29, 2012",4.5,I’ll certainly agree that most of the locals have a good idea going here: getting an Italian Ice from Mario’s right after Al’s is about as good a pairing as they come.,Kaszeta,22234920,10676668,DINING
Mario's Italian Lemonade,https://www.zomato.com/chicago/marios-italian-lemonade-university-village/reviews,"Jun 30, 2012",0,"It looks like the concession stand at an elementary school playground, but this is indeed a grown up lemonade stand. It's basically a fresh fruit slurpee called Italian Ice!",FollowMeFoodie,21084706,9165334,DINING
Tuscany on Taylor,https://www.zomato.com/chicago/tuscany-restaurant-wheeling/reviews,"Aug 29, 2018",4,"If you are a visiting or live around the Chicago area, Tuscany's on Taylor is a really great Italian restaurant to go to with friends and family in Little Italy. The menu is really strong with variety and delicious offerings. The pasta and seafood offerings are really great. As a starter, go for the tasty beet salad. For my main course, I typically go with the Linguine con Scampi, which is really delicious. They have an excellent wine list by the glass or bottle. The Tiramisu is one of the best renditions of this classic Italian desserts that I have ever had. I have consistently had great meals here with very attentive service.",Karandeep Singh,50379128,38710903,DINING
Tuscany on Taylor,https://www.zomato.com/chicago/tuscany-restaurant-wheeling/reviews,"Mar 01, 2014",4.5,Good entrees all around. Cheesecake was horrible but not as bad as service.,Sam,21176100,16153312,DINING
Tuscany on Taylor,https://www.zomato.com/chicago/tuscany-restaurant-wheeling/reviews,"Feb 05, 2013",0,"Good food, wish the atmosphere was more quaint. More cozy.",Angela Gouirand,23492477,16153309,DINING
Tuscany on Taylor,https://www.zomato.com/chicago/tuscany-restaurant-wheeling/reviews,"Sep 07, 2011",4.5,Average. Tried an array of starters. Found the meatballs and the sausage relatively dry and tasteless. Eggplant was cheesy but enjoyable. Opted for a light dinner of carpaccio. It turned out to be the most enjoyable dish of the evening. Standard issue Italian food. Would return to try one of their veal dishes. But not hurrying.,California3,20681583,16153306,DINING
Tuscany on Taylor,https://www.zomato.com/chicago/tuscany-restaurant-wheeling/reviews,"Feb 18, 2011",2,"Snobish staff. Didn't even stay for food, and never will.",Ysnn,21671957,16153303,DINING
Tuscany on Taylor,https://www.zomato.com/chicago/tuscany-restaurant-wheeling/reviews,"Oct 30, 2010",0,Tuscany. Very Nice.,Hangout Master,21548563,16153300,DINING
Tuscany on Taylor,https://www.zomato.com/chicago/tuscany-restaurant-wheeling/reviews,"May 07, 2009",4.5,"Tuscany Restaurant is very good! The service is wonderful, and the staff is very nice!",Flipper,20794987,16153297,DINING
Tuscany on Taylor,https://www.zomato.com/chicago/tuscany-restaurant-wheeling/reviews,"Mar 29, 2009",4.5,This place is amazing with great food and outstanding service! I have been coming here for so long and every time I come I would give it 5 stars!,Frank Brown,20794303,16153294,DINING
Tuscany on Taylor,https://www.zomato.com/chicago/tuscany-restaurant-wheeling/reviews,"Sep 01, 2013",0,"This Italian restaurant has been around for quite some time, allowing the hype to decrease, but the food quality to remain wonderful.  ",EatingForSanity,22812298,11036047,DINING
Stax Cafe,https://www.zomato.com/chicago/stax-cafe-university-village/reviews,"Jun 29, 2019",4,"This has been on my list for a while now and we could finally make it there on a nice sunny morning! We ordered  their Bombay chai, which was surprisingly good with and without milk, I might try and find those bags out to buy some for myself. We chose the make your own omelette option with our choices of meat and veggies, which turned out to be good along with their potatoes and pancakes on the side. We also ordered the standard house made pancakes which were fresh and fluffy. It was a decent amount of food for a light breakfast for two people. The service was quick and good. I would recommend this one if you are searching for a refreshing breakfast place in a nice neighborhood.",Sirisha,12565291,43756165,DINING
Stax Cafe,https://www.zomato.com/chicago/stax-cafe-university-village/reviews,"Feb 08, 2018",4,"This is a good choice for dining before or in between flights, and may be the only full-service restaurant at Midway. I enjoyed the Smokehouse Burger, which is very filling and great before a long flight. If you're simply looking for drinks, they have a nice bar as well, full of good selections on tap. Overall, this was a decent experience and a nice touch to an otherwise, mundane airport.",Simran Pande,37960120,33461124,DINING
Stax Cafe,https://www.zomato.com/chicago/stax-cafe-university-village/reviews,"Dec 12, 2017",4.5,"We walked into this cafe very randomly and the place was filled with people and we had to wait to get a table. They had some fun breakfast combos with Frittata, Pancakes, Omelets and French Toast. The place has a breakfast bar and they do serve fast, but the billing was miserably slow.",Anusha Manjunath,1034192,32737289,DINING
Stax Cafe,https://www.zomato.com/chicago/stax-cafe-university-village/reviews,"Oct 18, 2017",4.5,Stax is a go-to brunch place for me. Their frittatas and omelettes are really good. They serve great mini waffles and pancakes on the side and also some delicious house potatoes.   Come in early on a weekend and spend sometime enjoying the bright and welcoming decor and friendly staff. ,Vaibhav Ravichandran,1468638,32104533,DINING
Stax Cafe,https://www.zomato.com/chicago/stax-cafe-university-village/reviews,"May 07, 2017",5,"Well to start with, the place was full packed with more than 45 minutes of waiting to get seated. The menu is quite diverse, ranging from pancakes, french toasts to sandwiches, wraps and other delicacies. Quantity per dish is way more than expected. Super tasty and beautiful American Brunch. I personally liked vegetable omelette, chocolate chip pancakes(took half portion, was more than enough for one person), bombay chai(black Assam tea leaves along with other ingredients) Ambience:5/5 Service: 4.5/5 Food:5/5",Dhruv Mehta,5555561,30278935,DINING
Stax Cafe,https://www.zomato.com/chicago/stax-cafe-university-village/reviews,"Dec 31, 2015",5,"Yum yum yum yum... Just went here for brunch and since its a week day, there was no crowd. We love brunch and were not disappointed by the selection, quality or speed of the food. For your entrees, you can choose as your side: mini pancakes, mini waffles or toast. Pancake and waffle selection for minis include the specialty pancakes/waffles like strawberry rhubarb, banana dulce de leche and cinnamon roll...so good and minis are actually quite big. We also had a veggie skillet, meaty omelette, and sweet potato hash with scrambled eggs. Coffee is a bit expensive but its Intelligentsia for us coffee snobs. Our waitress was quick, courteous and gave us space to play cards after we ate :).",Kate And Monica,30643057,25876594,DINING
Stax Cafe,https://www.zomato.com/chicago/stax-cafe-university-village/reviews,"Oct 04, 2015",4.5,"I've been wanting to try out Stax Cafe's brunch for awhile now and when I finally did, I was really impressed. At 10:30 on a Saturday, the restaurant was crowded but we were seated right away. Intelligentsia coffee was a nice surprise and I indulged in a refreshing Strawberry Orange juice from the juice bar - a little pricey for a small ($4), but deliciously thick, like a smoothie.  My husband got the Starving Student and said the scrambled eggs were cooked to diner perfection. I got the Taylor Street Frittata and while it was good, the breakfast potatoes it came with stole the show.   The real stars were the mini pancakes we ordered - love that you can get mini versions of the huge variety pancakes and waffles on the menu. I got the peanut butter, chocolate and banana pancakes, which were light and fluffy but also decadent. My husband ordered the cannoli pancakes, which were laden with cream and somewhat heavy. He also ordered the rainbow pancakes which were his favorite. They were sweet, but not too sweet; he said they were the best pancakes he's had in the city yet.  The service at Stax was impeccable too. Our server was so sweet, attentive, and gave helpful recommendations to navigate the menu. I only wish this place was more accessible, but it's definitely worth the trip out to University Village/Little Italy.",Sarah,29031422,25131727,DINING
Stax Cafe,https://www.zomato.com/chicago/stax-cafe-university-village/reviews,"Aug 05, 2015",5,"One of the best brunch spots in Chicago in my opinion. Reasonable prices for the amount and quality of food you order.  Highly recommend their skillets, crepes, and chiliquiles!",Karen Dela Cruz,31096471,24521104,DINING
Stax Cafe,https://www.zomato.com/chicago/stax-cafe-university-village/reviews,"Jul 11, 2015",3.5,"Good breakfast food, but overpriced. I walked here from my hotel for breakfast one morning and was surprised by the prices. Juice and coffee were particularly expensive for a non-hotel restaurant.   The next day I ordered room service and, even with the all the service charges, it was cheaper, just as good, and more convenient. Stax really needs to rethink its prices.",Joseph Ion,30797841,24253365,DINING
Stax Cafe,https://www.zomato.com/chicago/stax-cafe-university-village/reviews,"Sep 03, 2014",2,"Undecided. The decor was suttle and modern. The dish I had was fresh and delicious. However, all the great things about this place are being over shadowed by the terrible service I received and the pricey menu. My waitress never bothered to check up on my table for 2. I eventually had to flag her down for the check. All the while the table next to me (with a different waitress) was treated like royalty compared to us. And as mentioned before, the breakfast menu was more expensive than their lunch menu! That just doesn't make any sense to me.",Desiree,22142148,16169104,DINING
Stax Cafe,https://www.zomato.com/chicago/stax-cafe-university-village/reviews,"Aug 20, 2013",4.5,"Well what a great place! I just happened to be in that area and was looking for good breakfast food and I found it. Great menu selection, nice ambiance and what a very nice staff. I would definitely go back again. Great place!",TC,24014744,16169101,DINING
Stax Cafe,https://www.zomato.com/chicago/stax-cafe-university-village/reviews,"Jul 21, 2013",4.5,"Good ambiance & feeling. Not a fan of all the small glasses for beverages. I got the Classic Eggs Benedict. Overall, I enjoyed it. I did have to ask for another side of Hollandaise sauce, however, as the initial portion was very small. My side of regular pancakes were good too. This, like many places, serves condiments (ketchup) in the small din dishes. I'm not a fan of this technique, but that's just me. Since Tobasco was served in the bottle, ketchup could be too. Just saying. Would come again.",Chance,21580983,16169098,DINING
Stax Cafe,https://www.zomato.com/chicago/stax-cafe-university-village/reviews,"Feb 15, 2012",4.5,Relaxing atmosphere / Bountiful menu selection / Clean good tasting food,Pickles Velour,22624011,16169095,DINING
Stax Cafe,https://www.zomato.com/chicago/stax-cafe-university-village/reviews,"Nov 08, 2010",2,"Delicious food, a little pricey, and the worst hostess I've ever seen. Not only was she very rude, she talked about the customers behind their back. While waiting for a table this hostess complained about coworkers, and how the customers didn't get the ""hint"" to pay their bill and clear the table for the next customers. She stated that anyone in for just coffee should have visited the starbucks down the street. I have NEVER seen such a rude hostess, and unfortunately she ruined my experience from returning to this establishment.",Stephanie,21558752,16169092,DINING
Stax Cafe,https://www.zomato.com/chicago/stax-cafe-university-village/reviews,"Sep 02, 2010",4.5,"Ordered tha ""blueberry"". Excellent blueberry pancakes with a blueberry compote on top. Included a side of pepper bacon to balance the sweetness. A little pricey, but would recommend for breakfast. Also, try a juice ... We had the apple, made when you order with only fruit (no water or sugar added) - thought I was taking a bite of an apple!",Roger,21037490,16169089,DINING
Stax Cafe,https://www.zomato.com/chicago/stax-cafe-university-village/reviews,"Feb 07, 2014",4.5,"I got ricotta strawberry pancakes, and though you couldn’t taste the ricotta, it definitely lent itself to a fluffier texture than normal pancakes.  The preserves were sweet, and the syrup was hot.  Yum. Chicken sandwich and fries! Shravan’s chicken sandwich came with a cute side of fries, complete with deep frier container! Eggs benedict and parmesan potatoes! Fred’s eggs and potatoes looked good to me, but apparently, they still weren’t as good as Aut Bar’s. Check them out on Yelp or their official website ! About these ads div.wpa>div { margin-top: 1em; } #google_ads_div_wpcom_below_post_adsafe_ad_container { display: block !important; } Share this: Email Twitter ",CloverEats,24232251,11586739,DINING
Stax Cafe,https://www.zomato.com/chicago/stax-cafe-university-village/reviews,"Dec 05, 2012",4.5,"After the fun Santa Hustle 5k, my friends and I were looking for a breakfast joint to grab a quick bite to eat.  Located in the middle of Little Italy (near UIC), we arrived at Stax.  This restaurant pride itself in offering a variety of entrees that focus on wholesome ingredients.  From the half dozen pancakes to the half dozen waffles to all the different omelets and skillets, Stax's variety will not disappoint.  ",EatingForSanity,22812298,11035345,DINING
Stax Cafe,https://www.zomato.com/chicago/stax-cafe-university-village/reviews,"Jun 13, 2011",0,... Chocolate Chip Bacon Pancakes. Can I get an ay-men.,With Reservations,21736128,10143781,DINING
Stax Cafe,https://www.zomato.com/chicago/stax-cafe-university-village/reviews,"Oct 31, 2013",0," After our roundabout adventure trying to find a brunch spot, Stax Cafe served an excellent and convenient purpose. That aside, Amanda was equivocal with her breakfast, and I took some issues with my dish. I'm giving them 1.5 out of 5 Pearls.",Jeff,21400427,9611824,DINING
Jim's Original Hot Dog,https://www.zomato.com/chicago/jims-original-university-village/reviews,"Aug 28, 2018",4,Best polish EVER  I love this place! Stop by often for a quick bite. The Maxwell street polish is the best! I also love their fries. They are fast too.,Priya Oberoi,50173498,38698263,DINING
Jim's Original Hot Dog,https://www.zomato.com/chicago/jims-original-university-village/reviews,"Feb 08, 2018",4,"As the previous reviewer mentioned, Harry Caray's Seventh Ining Stretch is a bit cramped, but space is very limited for airport restaurants.  A co-worker and I visited Harry Caray's during lunch hour. All of the restaurants were busy, including Harry's. We were told that we would have a 5 - 10 minute wait for a table, which isn't bad. We ended up waiting only about two minutes.  Our server was very personable and efficient. Our drink orders were taken and drinks delivered very quickly. They have a pretty good list of draught beers available. Boith domestic and import. I ordered a Stella Artois with a chicken wrap with a roasted vegatable pasta salad and my co-worker ordered the Holy Cow Burger with fries. Both sandwiches and sides were very large. The chicken wrap contained chunks of chicken breast with roasted corn, lettuce and a very nice vinegarette dressing. The vegatbales in the pasta salad had a nice roasted flavor to them and the pasta was cooked just right. The dressing on the salad was a little on the sweet side for me but, that's just a personal preference. It was still very good. The Holy Cow Burger was ordered to be cooked medium but, it was actually cooked medium rare. The fries were light and cooked perfectly.",Simran Pande,37960120,33461101,DINING
Jim's Original Hot Dog,https://www.zomato.com/chicago/jims-original-university-village/reviews,"Feb 02, 2018",5,"You come to Chicago, you come here. Been going to Jim’s since before I could remember! If I’m anywhere within a few miles from Jim’s around lunch time or a quick L ride away you better believe that’s where I’m headed! Jim’s has a polish literally like no other as their polishes are specially made for them. After a long trip and I come back home I always stop at Jim’s!   Also, since the White Sox let you bring outside food into Comiskey, I’ll pick up a bag before a game",Javier A. Montaño Jr.,50499912,33387712,DINING
Jim's Original Hot Dog,https://www.zomato.com/chicago/jims-original-university-village/reviews,"Nov 13, 2015",3.5,"On my way home the night before my Uber driver told me to check out Jim’s original so before breakfast I did just that. The place is the last standing Establishment of its kind in the area, keeping its authenticity all these years and having no Affiliation with the copy cats it is 76 years strong.",Steak Me Out,22834100,25483961,DINING
Jim's Original Hot Dog,https://www.zomato.com/chicago/jims-original-university-village/reviews,"Jul 07, 2015",5,"Gotta have a pork chop sandwich before I kiss my mom. Flew in on June 30th first stop Maxwell Street. Mmm, mmm, good. Snuck a polish also.  24/7 always open, drunk or sober best food in the city.",Jimmy,22273213,24212526,DINING
Jim's Original Hot Dog,https://www.zomato.com/chicago/jims-original-university-village/reviews,"Oct 13, 2014",4.5,"Great food, must go!. No seats, take and go. Had the pork chop sandwich, just to say I had it. It was ok, the best was the polish sausage, kids are picky right? They ate them all! I got two bites! Smoky grilled delicious mustard and grilled onions, that's it. This is a $5 uber ride from downtown. Must go.",Verbil Kent,21574297,16100176,DINING
Jim's Original Hot Dog,https://www.zomato.com/chicago/jims-original-university-village/reviews,"Jan 03, 2012",4.5,"PORK CHOP sandwich. Started coming here in the mid 1980's late night/wee hours in the a.m., you would have to walk through ankle high garbage and be in line with pimp's and thugs but it was worth the wait the best pork chop sandwiches and polishes.The smell of a mountain of onions grilling is amazing. It has cleaned up big time since the days of the Old Maxwell Street market.",KELVIS,22097305,16100173,DINING
Jim's Original Hot Dog,https://www.zomato.com/chicago/jims-original-university-village/reviews,"Dec 13, 2011",4.5,"Best late-night snack ever. This place is open 24/7 and offers freakin good polish sausages, hot dogs, and chicken sandwiches. CHEAP and delicious. If you're a student they will give you a free soda as well.",Natey,22313590,16100170,DINING
Jim's Original Hot Dog,https://www.zomato.com/chicago/jims-original-university-village/reviews,"Mar 01, 2011",4.5,If god created better munchies/drunk food better than Jim's Original. Then he kept it for himself,Spencer Fritz,21781168,16100167,DINING
Jim's Original Hot Dog,https://www.zomato.com/chicago/jims-original-university-village/reviews,"Feb 20, 2009",4.5,You can't go wrong at Jim's. Cheap price for a good snack!,Weaksauce,20729901,16100164,DINING
Jim's Original Hot Dog,https://www.zomato.com/chicago/jims-original-university-village/reviews,"Dec 01, 2008",4.5,The original. Want a real Maxwell Street Polish? Get it here.,Dan360man,20607673,16100161,DINING
Jim's Original Hot Dog,https://www.zomato.com/chicago/jims-original-university-village/reviews,"Jan 24, 2015",0,"Being in Chicago early morning, I was looking for someplace that was possibly open 24/7.  I stumbled upon Jim's Original and it was exactly what I was hoping it would be, an eatery open 24/7 serving street food.",World Food Cruiser,23342306,11267137,DINING
Jim's Original Hot Dog,https://www.zomato.com/chicago/jims-original-university-village/reviews,"Oct 20, 2012",0,"Located right off of the highway, you can tell it is a well-established, historic restaurant in Chicago.  People come from all over the city to grab a bite from this hot dog stand.  They offer more than just hot dogs however; their Polish Sausage is delicious, but ",EatingForSanity,22812298,11035246,DINING
Jim's Original Hot Dog,https://www.zomato.com/chicago/jims-original-university-village/reviews,"May 18, 2012",4.5,"you've driven by them many times (they sit side-by-side) heading south on the dan ryan but never stopped. well, you should. foot traffic is steady, the grill is crowded with sausage and chops and fries are free with all sandwiches!  we had the two top contenders in this fight - polish sausage with mustard and grilled onions and the on-the-bone pork chop sandwich with mustard and grilled onions.  at first we were concerned as there aren't any seats, just a counter.  fortunately once the food arrived our concerns disappeared, as did our food!",Fourfried.com,22762375,10975357,DINING
Jim's Original Hot Dog,https://www.zomato.com/chicago/jims-original-university-village/reviews,"Sep 22, 2012",4.5," Jim's Original is a piece of Chicago history. It's pretty convenient to hit up if you're going to or coming from a Sox game. The sausages are great, but everything else is the standard greasy stuff you'd expect from an average stand. I'm giving them 3.5 Pearls.",Jeff,21400427,9610783,DINING
Jim's Original Hot Dog,https://www.zomato.com/chicago/jims-original-university-village/reviews,"Nov 05, 2009",4.5,"Its been a longtime coming. Its not just pizza, hot dogs and beef when it comes to Chicago's signature food items. Also in the realm of discussion is the famous Maxwell Street Polish Sausage. Said to have been introduced to the people of Chicago in 1939 b",KingT,20758887,8885812,DINING
Al's  1 Italian Beef,https://www.zomato.com/chicago/als-beef-lakeview/reviews,"Apr 21, 2012",4.5,"I would 100% recommend Al's and can't wait to go back for more!. For my last lunch while visiting my sister, I wanted another Chicago classic, and research showed me Al's was not only close to her apartment, but also highly recommended by locals.  My boyfriend and I ordered the Regular Al Italian Beef to share, while my dad and sister each got one of their own. The fries looked and smelled good, but we had chips already, so we skipped the fries. We ordered our sandwich in true Chicago style, wet and with giardiniera peppers. My dad got his wet with bell peppers and my sister got hers dry with bell peppers. Ours was by far the best, and the giardiniera peppers and the extra juice definitely put our sandwich on top. The meat was SO moist and juicy, the juice was full of flavor, and the giardiniera peppers added that bit of spice and crunch that made it perfect.",Becky W,22140112,16177405,DINING
Al's  1 Italian Beef,https://www.zomato.com/chicago/als-beef-lakeview/reviews,"Nov 10, 2012",0,"I had the Little Al Italian beef combo. The fries were good, not covered in salt, freshly cooked, and I did not need to drown them in sauce to make them palatable. The sandwich meat was nicely tender thinly sliced and had a good peppery gravy taste",My Food Hunt,22816888,11238352,DINING
Al's  1 Italian Beef,https://www.zomato.com/chicago/als-beef-lakeview/reviews,"Aug 18, 2012",0,"You definitely need at least some broth on this sandwich. The beef is good on its own, but it’s the juices that really make this thing stand out. Without the juice, you just have a regular sandwich and fries that you could get at any sandwich store. With it, you have a true taste of Chicago.",Nighthawk892005,21266665,11141989,DINING
Pompei,https://www.zomato.com/chicago/pompei-little-italy-streeterville-streeterville/reviews,"Sep 08, 2012",4.5,"Three of us had three different entrees, good food and staff was great.",Tater,21490304,16166584,DINING
Pompei,https://www.zomato.com/chicago/pompei-little-italy-streeterville-streeterville/reviews,"Oct 08, 2011",4.5,"Delicious, filling, and overpriced.",Ben Cober,22269336,16166581,DINING
