restaurant_name,link,date,rating,review,user,user_id,review_id,order_type
Pompei,https://www.zomato.com/chicago/pompei-little-italy-streeterville-streeterville/reviews,"Dec 13, 2010",4.5,"GOOD PIZZA ON A BAD NIGHT!. The Pizza...I ordered during a big snow storm and they delivered in less than an hour! In fact the delivery man walked it over!!! It arrived in a a rectangle box, so I was a little confused, but it is a rectangle pizza so it makes sense. The cheese is great, and so were the mushrooms and sausage. Although I ususally prefer a thin crust this is about 1/2 inch thick and the crust is very good and light. I would say yes, but next time I have to try one of their great salads! I like this place!",Maija7,21605656,16166578,DINING
Pompei,https://www.zomato.com/chicago/pompei-little-italy-streeterville-streeterville/reviews,"Dec 04, 2010",4.5,Not bad pizza. Crisp airy.... Not bad square Sicilian slices - crisp airy crust and surprisingly tasty cheese. Pretty good for mass-produced pizza.,Joe,21045393,16166575,DINING
Pompei,https://www.zomato.com/chicago/pompei-little-italy-streeterville-streeterville/reviews,"Jun 29, 2010",4.5,"Great little casual Italian spot in Streeterville where you order at a counter and they bring your food to you. We went in about 20 min before closing time and the service was top notch. They never made us feel like they were in a rush to get us out of there. Their pizza is great, but they also have pasta, panini and other dishes. If you are in the mood for good quality casual Italian you can't go wrong here.",Bazoo,20945745,16166572,DINING
Pompei,https://www.zomato.com/chicago/pompei-little-italy-streeterville-streeterville/reviews,"Sep 21, 2011",0,"Pompei serves a nice purpose in providing large meals in a quick way at a low cost. It's nothing you can't get elsewhere, but when you're hungry and it's close by, it's not too bad a choice. If you're in Streeterville, I'd suggest Volare instead, and if you're in Little Italy then there are a lot of options. If you've only got an hour for lunch though, this might be your place. I'm giving them 2 out of 5 Pearls.",Jeff,21400427,9609484,DINING
Hashbrowns,https://www.zomato.com/chicago/hashbrowns-university-village/reviews,"Feb 09, 2018",4,"The best part of the pub is its location, right in the center of Chicago's food hub. The interior is rather like a UK public drinks flowing and grub plain but tasty and kind of a family atmosphere. Its often loud but friendly none the less. The burgers and fries are just good as are the other menu items yet the piece de reistance is the delicious cake. The chocolate cake is magnificent and not to be missed.",Bhim Joshi,39542829,33477925,DINING
Hashbrowns,https://www.zomato.com/chicago/hashbrowns-university-village/reviews,"Oct 02, 2015",3.5,"This is your standard, American breakfast spot. I like their concept, which is centered around one of breakfast's strongest players. They have multiple different hashbrown styles, but my absolute favorite are the house - grated sweet potato! My standard order is a side of these with bacon. Perfection. We have also had an omelette, banana wheat pancakes, and rosemary hashbrowns. All good. Nothing great. But there's not much like it in the area, so they get brownie points for that!",Erin Thor,32025791,25101602,DINING
Hashbrowns,https://www.zomato.com/chicago/hashbrowns-university-village/reviews,"Aug 05, 2013",4.5,"Run, don't walk to this place it's great",Caromm,22994900,16098523,DINING
Hashbrowns,https://www.zomato.com/chicago/hashbrowns-university-village/reviews,"Dec 23, 2007",2,"Hashbrowns?. Overall it is good, sometimes inconsistent with there hashbrowns.   Like the decor.",Westlooper23,20606790,16098520,DINING
Hashbrowns,https://www.zomato.com/chicago/hashbrowns-university-village/reviews,"Oct 11, 2007",4.5,"Awesome Chow. This place rocks. The sweet potato hash browns and the omlettes are out of this world. The HUGE cups of bottomless house coffee are stellar as well.   The omlettes are cheesily named after Chi-town neighborhoods, and you may interrupt a communist party meeting there, but overall a ten.",Bill B,20604510,16098517,DINING
Hashbrowns,https://www.zomato.com/chicago/hashbrowns-university-village/reviews,"Aug 25, 2012",4.5,"All college campuses need a couple of solid breakfast joints for students to flock to either before their mid-term exam, after a long night of drinking, or whenever they get sick of dorm food.  Hashbrowns fulfills this need for the UIC students, as well as locals, living on ""south campus.""  This breakfast place features breakfast ",EatingForSanity,22812298,11035108,DINING
Hashbrowns,https://www.zomato.com/chicago/hashbrowns-university-village/reviews,"Sep 30, 2011",4.5,"The waffles were perfect in texture, with a nice crisp outside and a light, airy inside. The sauce packed just the right punch of flavor, adding an almost fruity taste to the confections. But as Brandy's eternal war",Bunny And Brandy's Brunchtime Blog,22071168,10458553,DINING
Hashbrowns,https://www.zomato.com/chicago/hashbrowns-university-village/reviews,"Apr 24, 2011",0,Good space. Outstanding food.,Gino Williams,21579640,10024327,DINING
Chilango,https://www.zomato.com/chicago/chilango-university-village/reviews,"Jun 21, 2018",4,I have been to this place multiple times. I love their burrito bowl as well as their burrito. The guacamole and chops is one of the default dishes you are supposed to order over here. I am not a great fan of their elote and wouldn't recommend it unless you are a cheese lover. Also a special mention for their fish tacos. The place is decent and crowdy in the evenings during the week.,Sirisha,12565291,36490576,DINING
Chilango,https://www.zomato.com/chicago/chilango-university-village/reviews,"Oct 20, 2017",5,"Oh man. This is the first bite of food I had in Chicago.   I've tried all of their tacos and the fish and al pastor are my favorites. Their burrito is excellent and so is pretty much everything else on the menu.  What makes Chilango special is their sauces. They serve a mild, medium and spicy sauce. I usually drench my tacos in the mild and medium sauce and I swear it's the best taco I've had anywhere in Chicago. It's amazing how good the sauces taste.    When you're done with the tacos and you need some dessert, the Nutella banana empanada should do nicely. Careful tho, it's hot af, filled with gooey Nutella and sliced ripe bananas",Vaibhav Ravichandran,1468638,32116102,DINING
Chilango,https://www.zomato.com/chicago/chilango-university-village/reviews,"Dec 18, 2016",3,"Mexican food with some fine touches to interiors.  I was on my back home and under the showers of snow spotted chilango .... I was hungry and wanted a spot to hide from snow ... So without second thoughts hopped into chilango. The place serves one of the best Mexican food. The chicken taco was sweet little peice of art, perfect to fit in your palm. This surely can't kill your hunger so orders Quesadilla - steak. This was a complete meal... Taco with cheese and steak. Combination tastes average and the quantity was satisfying for the Price.  Interiors has some fine touches like skulls on the seats ...colorful chairs... Overall a nice feel .  Suggestion : opt for dine in rather than take away or Delivery as it tastes best when hot. ",Boom_0.0 (Sourabh Taluja),254965,28978788,DINING
La Taberna Tapas on Halsted,https://www.zomato.com/chicago/la-taberna-tapas-university-village/reviews,"Apr 08, 2018",1,"This place is a joke. My fiancee and I were planning on having our wedding reception here, being that it was to be a small wedding and planned very quickly. The chef who we dealt with was very accommodating, and we had a verbal agreement with everything we wanted.   Before we had a chance to draft up a formal contract, we found out that the chef had quit and we were to deal with another one of the managers there. After we got worried we were going to have to rework out our deal, he told us we had nothing to worry about, the original terms would be honored, and he would get the contract together.   Literally one week before our wedding, the owner of the restaurant calls my fiancee' and would not agree to anything near what was agreed upon, wanting to charge us nearly double of what we were originally promised. He knew we were in a very difficult position and tried to take advantage of us. This is a horrible way to conduct business and no matter how much it ruined our wedding, I was not going to let this man hold us hostage. We found another restaurant literally 4 DAYS before the wedding and made the most of a bad situation.   I wish the story would end there, but unfortunately it does not. Since we put a $1000 deposit down on a credit card, we received a check from the restaurant reimbursing the money. The maid of honor, however, was not as lucky. She wrote them a check for $300 to help with the liquor cost, and we were returned the check, as the restaurant claimed they did not cash it. Only it turns out they did. When we confronted the owner about this, he claims we were given ""cash"" back and not the check. How he knew this, we have no idea... we never even met him in person. We dealt with the manager, who it turns out doesn't even work there anymore either! He refused to give her the money back and literally told us ""do what you want about it"" and hung up on us, knowing full well it is our word against his, and it would not be worth taking him to court over $300. After months of attempting to meet in person with him and not having any luck, we have given up.  This man is not worthy of owning a restaurant and I encourage others to stay away from this place. Someone of his character does not deserve your business. I am not one to write reviews, but I needed to tell my story. If for whatever reason you need to plan a party with this place, ensure you get everything in writing and sign a contract the MINUTE you have a deal to avoid their shady business practices.  WE DO NOT RECOMMEND THIS RESTAURANT TO ANYONE!!!!",Mike Wagner,53026708,34483432,DINING
La Taberna Tapas on Halsted,https://www.zomato.com/chicago/la-taberna-tapas-university-village/reviews,"Oct 02, 2015",3.5,"La Taberna is much needed in the area as there is nothing else like it around. I must note that I've only gotten takeout from here, and only one time. I'll definitely update my review once I get a chance to dine inside, as I think that might change my opinion a bit. I thought the food was just okay. I am a lover of tapas, and have tried every bacon wrapped date and queso de cabra in the city. It seemed to me that this place just slightly missed the mark. I will absolutely give it another try because I so want this place to succeed! Plus, you can't get sangria to-go ;-) ",Erin Thor,32025791,25107340,DINING
La Taberna Tapas on Halsted,https://www.zomato.com/chicago/la-taberna-tapas-university-village/reviews,"Oct 31, 2012",4.5,"La Taberna Tapas another excellent place to eat tapas... sweet Sangría, savory and delicious Paella, creative and spectacular tapas in general a must to go place to eat with friends or for a Romantic dinner. I recommend it and would visit again!!!",Maribel Quinones,21779132,16171279,DINING
La Taberna Tapas on Halsted,https://www.zomato.com/chicago/la-taberna-tapas-university-village/reviews,"Nov 09, 2011",4.5,"I was a bit reluctant to attempt this Tapas as I'd invited a large group from out of town and the menu wasn't as expansive as Im use to. I'm glad we went. The pappas delicious, garlicky, spicy, shrimp, croquettes, olives, mussels, paella all done to perfection. Blueberry sangria was delightful. I did have to request twice they slow down on serving the dishes. A quick meal takes away from the experience. The only other complaint is how extremely dark they keep the lighting. The ambiance while romantic was practically like ""where's the flashlight to find my way to the restroom?""",Dolly,22301770,16171276,DINING
Lotus Cafe & Banh Mi Sandwiches,https://www.zomato.com/chicago/lotus-cafe-b%C3%A1nh-m%C3%AC-sandwiches-university-village/reviews,"Sep 30, 2015",5,"I adore this sandwich shop. They serve semi-traditional to non-traditional Vietnamese banh mi. The two best menu items, in my opinion, are ginger chicken and veggiecado. Their sandwiches are somewhat spicy due to the fresh sliced jalapeno, and the bread is crispy and delicious. I also love the sweet and spicy wings appetizer! They make great smoothies as well - try the red bean and coconut. It's a small shop, mostly designed for takeout, so keep that in mind.",Erin Thor,32025791,25089672,DINING
Lotus Cafe & Banh Mi Sandwiches,https://www.zomato.com/chicago/lotus-cafe-b%C3%A1nh-m%C3%AC-sandwiches-university-village/reviews,"Aug 09, 2015",4.5,"Spot on bahnmi, the honey pork was just sweet and savory enough. Cute patio and honestly can't rave enough about the Vietnamese iced coffee, real deal and oh so perfect, espresso u got nothing on this!",Leera Basu,30457507,24564730,DINING
Lotus Cafe & Banh Mi Sandwiches,https://www.zomato.com/chicago/lotus-cafe-b%C3%A1nh-m%C3%AC-sandwiches-university-village/reviews,"May 25, 2014",4.5,"This is so far the best Vietnamese Banh Mi Sandwich I've ever tried in Chicago! Pork belly classic was the perfect blend of ingredients. The bread was crunchy and soft, the slightly warm meat was enhanced by the crunch of the veggies and mild vinegar flavor of the pickled toppings. Delicious!",Sriwina,24559391,16179244,DINING
Lotus Cafe & Banh Mi Sandwiches,https://www.zomato.com/chicago/lotus-cafe-b%C3%A1nh-m%C3%AC-sandwiches-university-village/reviews,"Sep 29, 2012",4.5,"Finally!  Lotus Cafe is one of the first Vietnamese restaurant to open near UIC or better yet, the south side of Chicago!  I have been waiting forever for a place to serve banh mis and THEY DO IT WELL!  The concept of Lotus Cafe is great... if you are hungry you can order one of the larger banh mi sandwiches, but if you are just looking for a small quick snack, they offer the recently-made-popular bao!  ",EatingForSanity,22812298,11035183,DINING
Hawkeye's Bar & Grill,https://www.zomato.com/chicago/hawkeyes-bar-grill-university-village/reviews,"Oct 20, 2017",4,Visited Hawkeye's as a group on a weekend. It was great. Ambience is very good and they have a large menu for a bar n grill.   Great selection of cocktails and burgers and finger food. I had their make-your-own burger with a side of fries and it did not disappoint. ,Vaibhav Ravichandran,1468638,32115715,DINING
Hawkeye's Bar & Grill,https://www.zomato.com/chicago/hawkeyes-bar-grill-university-village/reviews,"Sep 03, 2014",4.5,"Good bar. Great to watch games, food is good, and provide free parking down the road",Mediator_99,24929779,16098538,DINING
Hawkeye's Bar & Grill,https://www.zomato.com/chicago/hawkeyes-bar-grill-university-village/reviews,"Jun 23, 2014",0,"Docmark. My daughter and I had lunch this afternoon and I really enjoyed it. We sat outside and our server was prompt, courteous and friendly. The food and drinks came out quickly and we both enjoyed our meals. I had a delicious chicken sandwich and my daughter enjoyed her southwestern wrap. I eat at lots of restaurants and wouldn't hesitate to recommend Hawkeye's for a casual lunch, dinner or snack.",Docmarkr,24687847,16098535,DINING
Hawkeye's Bar & Grill,https://www.zomato.com/chicago/hawkeyes-bar-grill-university-village/reviews,"May 28, 2012",0,"Excellent Char-Broiled Burger!!!. The charbroiled burger here is excellent!!! Also, the Bistro Salad is very good. I'm a regular:)",Jeff Haase,22860174,16098532,DINING
Hawkeye's Bar & Grill,https://www.zomato.com/chicago/hawkeyes-bar-grill-university-village/reviews,"Jan 18, 2011",4.5,Very great the burgers amazing not much more to say 7.5 out of 10- shawn,Shawn D.,21667542,16098529,DINING
Hawkeye's Bar & Grill,https://www.zomato.com/chicago/hawkeyes-bar-grill-university-village/reviews,"Feb 28, 2009",4.5,"Great place to have drinks with freinds. Food is pritty good, it's priced right for what it is.",Freddy,20799504,16098526,DINING
Conte Di Savoia,https://www.zomato.com/chicago/conte-di-savoia-university-village/reviews,"Feb 09, 2018",4,"Welcome to Chicago! One of the things you should do is try some of the local specialties when it's time to eat.   Portillo's is a local chain, which has spread out to a few other states to accommodate retirees who have fled our delightful winters. Warren Buffet bought the chain for some ungodly amount of money. Hopefully, this was merely to secure a steady stream of cheese fries for the ""Oracle of Omaha"" and the quality of the food will remain high.   Ok. For starters, brace yourself to be overwhelmed by kitsch. That's ok. Tourists and kids love it. Second, follow the lines to oder. Third, the food is going to take a while to prepare. They'll call out your receipt number when the food is ready.   May I suggest a few items from the menu?  Italian Beef -- Not very Italian. I've never seen anything like it in Italy. Maybe it's the collection of spices? Maybe it was sold by Italian immigrants? It is delicious. It's the best in this city. For the uninitiated, it's a serving of shaved roast beef on a six inch bun doused in the salty beef ""au jus."" I like mine with hot peppers, but you can get them with sweet pepper too. Cut it in slices and share if you'd like.   Hot dog -- Some call this sausage a Frankfurter or a Wiener. Wenn Sie deutsch sind, ähnelt diese Wurst einer Bockwurst. Chicago style unless you say otherwise. Try it that way, we'd say it's the only way, i.e. NO KETCHUP! (Toddlers may add ketchup, we are understanding of such things. They'll learn)",Priyam Singh,39432558,33473889,DINING
Conte Di Savoia,https://www.zomato.com/chicago/conte-di-savoia-university-village/reviews,"Sep 30, 2015",5,"THIS. PLACE. ROCKS. It's an authentic Italian market and deli with everything you could ever need if you're making an Italian meal for dinner, or simply want to grab a delicious sandwich/sides. We often do both! The prices are extremely reasonable too. The Italian sandwich is delicious - get the hot peppers! And the outdoor seating during summer is just lovely on Taylor.",Erin Thor,32025791,25090457,DINING
Conte Di Savoia,https://www.zomato.com/chicago/conte-di-savoia-university-village/reviews,"Jul 27, 2012",4.5,"GREAT sandwiches at a GREAT price, although I wouldnt necessarily say healthy as the comment below does.",The Fundamentalist,20929191,16092106,DINING
Conte Di Savoia,https://www.zomato.com/chicago/conte-di-savoia-university-village/reviews,"May 02, 2011",4.5,Great sandwhiches with a good price considering it's fresh homemade and healthy,Martina Osicka,21946240,16092103,DINING
Conte Di Savoia,https://www.zomato.com/chicago/conte-di-savoia-university-village/reviews,"Aug 14, 2010",4.5,"Mama Mia!. This place is an experience. They have an incredible selection of interesting stuff that you can't find anywhere in Indiana. Take, for example, the octopus salad (see photo). It's divine. Simple, tasty ingredients prepared with care and good taste.  Their sandwiches are great, too. I like the Italian sub. It's reasonably priced, stacked with delicious meats and cheeses on fresh crusty bread. The bread is not the best you'll ever have, but it works perfectly for this sandwich.  My best friend Austin likes to stock up on fancified olive oil, tomatoes, giardiniera, etc. when we go there. The prices on those items are not as reasonable, but hey, it's premium stuff, some of which has traveled farther than most of us.  This is a great place to start a food vacation to Chicago. As a second stop I recommend Al's #1 Italian Beef, which is about a mile down Taylor Street toward downtown. Enjoy!",El Duderino,21461145,16092100,DINING
Conte Di Savoia,https://www.zomato.com/chicago/conte-di-savoia-university-village/reviews,"May 06, 2012",0,"Conte di Savoia is a great sub shop in Little Italy! They make all their subs fresh to order and they are decent sized (6 inch or 8 inch) depending on how hungry you are. The price is a little bit more expensive than the other sub shops around chicago (which I will post later on). But if you want a fresh italian type sub.. this is a good option. What I Ate: Italian Sub Ham, salami, cappocollo, and provolone cheese make up the inside of this sub! And you can have additional toppings like lettuce, tomato, onion, and a red vinaigrette for no extra cost. I like to add hot giardinera... but these peppers cost a little extra but is well worth it! The meat is definitely fresh (cut when you order) and the bread has a nice chewiness to it... and its not too tough! I do wish the ham was an italian ham and not just an American type ham... And also, they don't stack the meat on like other sub shops... just pointing it out! Pas",EatingForSanity,22812298,11034766,DINING
Conte Di Savoia,https://www.zomato.com/chicago/conte-di-savoia-university-village/reviews,"Aug 03, 2012",4.5,"I first walked into the original Conte di Savoia when my buddy Josh moved to that part of town 3 years ago. I was more than pleased at the smaller location right around the corner from the VA. The sandwiches are interesting and well seasoned, but the bread was probably the strongest component. I'm giving them 4 out of 5 Pearls.",Jeff,21400427,9610453,DINING
Conte Di Savoia,https://www.zomato.com/chicago/conte-di-savoia-university-village/reviews,"Nov 16, 2009",0,I've noticed quite a few new Subway's opening up around the city...WTF?!?!? to go with this they still have those corny commercials on the air what seems like all the time. Well lets just say if your going to Subway in this city you need to move to Rockfo,KingT,20758887,8885827,DINING
Busy Burger,https://www.zomato.com/chicago/chicagos-busy-burger-university-village/reviews,"Oct 17, 2017",4.5,"I live right next to this place on Taylor and May and they have delicious burgers. I usually have the Stuffed Turkey Burger which is always cooked perfectly and tastes great with their busy sauce. The busy blob fries are amazing and a dish on their own.  The milkshakes are awesome. All of them. Made with organic ice cream and it's so thick it will not spill if held upside down. No joke, I've actually tried this.   If you drop in you are also eligible for a 15% discount on showing a valid student ID card or if you're in the police department. ",Vaibhav Ravichandran,1468638,32093262,DINING
Busy Burger,https://www.zomato.com/chicago/chicagos-busy-burger-university-village/reviews,"Apr 14, 2016",4.5,"Americans have been in love with burgers arguably since the first fast food chain (White Castle) launched in the 1920s, but the current infatuation is thought to have come to the forefront around 2011. There are several theories as to why the burger business amped up at that point in time, but many feel it was the result of a tough time in the economy – people wanted their beef quotient but at the time, couldn’t justify buying steak.",P,21222560,26729584,DINING
Busy Burger,https://www.zomato.com/chicago/chicagos-busy-burger-university-village/reviews,"Dec 06, 2016",3.5,"When we had the chance to check out the newly revamped Busy Burger, we didn't hesitate. Both of us have attended school at the University of Illinois - Circle Campus, so it was good to get back into the neighborhood. It's been a while. Parking was a breeze on a Saturday afternoon, surprisingly, but we didn't complain. Busy Burger touts itself as a healthier casual eatery, with never frozen, made by hand burgers, hand spun shakes and fresh cut fries. They use no preservatives, hormones, or antibiotics. Always a fan of this kind of philosophy.",Kovas Palubinskas,21317685,26367974,DINING
Busy Burger,https://www.zomato.com/chicago/chicagos-busy-burger-university-village/reviews,"Sep 09, 2015",4.5,In a town with a LOT of burger joints this place really stands out...love the mushroom burger and the mini burgers. Also the healthiest burgers in town for sure.,GLOBEATER,24433863,24873414,DINING
Busy Burger,https://www.zomato.com/chicago/chicagos-busy-burger-university-village/reviews,"May 03, 2011",4.5,"Good homemade burger, no unnecessary fluff. Watch out for spicy mayo if you aren't into spice.",Christina,20898547,16091548,DINING
Busy Burger,https://www.zomato.com/chicago/chicagos-busy-burger-university-village/reviews,"Jan 29, 2011",2,"Not that busy, but they act like they are. For a place that comes off as a near-fast food place, burgers take too long. and when i bit into it, i tasted a possible reason why. dry. needed to wash every bite down with a gulp of coke. and not an isolated incident, been there twice now.",Kevin Cleofe,21695076,16091545,DINING
Busy Burger,https://www.zomato.com/chicago/chicagos-busy-burger-university-village/reviews,"Apr 20, 2010",4.5,Best burger in chicago!! I love u busy burger,Erika K,21330817,16091542,DINING
Fontano Foods,https://www.zomato.com/chicago/fontano-subs-university-village/reviews,"Apr 11, 2014",0,"When In Chicago...........and you're hungry for the best subs around stop at a Fontanos. They are many of them now. My favorite is Fontanos Foods on Polk in Little Italy. Address is above. I like the Blockbuster. They cut it so you have a meal the next day. It's great. Mild or hot Gardineria add makes it better. Go ahead, stop by and enjoy...!!",Low And Slow Cooker,21954289,16095280,DINING
Fontano Foods,https://www.zomato.com/chicago/fontano-subs-university-village/reviews,"Sep 16, 2012",4.5,The best sub in Chicago.,Keith C.,20718709,16095277,DINING
Fontano Foods,https://www.zomato.com/chicago/fontano-subs-university-village/reviews,"Nov 09, 2011",0,Good subs and good offerings for a quick fast bite.,Dolly,22301770,16095274,DINING
