restaurant_name,link,date,rating,review,user,user_id,review_id,order_type
Giordano's,https://www.zomato.com/chicago/giordanos-pizza-south-loop/reviews,"Jun 10, 2019",3,"It's famous for its deep dish pizza, we happened to try out on our recent trip to Chicago. But truly one mistake from the person who took the order ruined our experience, as by mistake he punched Broccoli instead of chicken Breast. And the flavor of broccoli was so prominent that it over powered the taste of other two types of chicken. For records, we had ordered one of their ""create your own pizza"" with all our favorite types of chicken. 50% of the pizza amount was waived off from our bill amount after I spoke to the manager. But nothing is justified for the ruined experience as we had walked for almost 25 minutes and then there was a waiting for 5 minutes plus the pizza took 45 minutes to be baked.  The true Giordano experience will have to wait until we plan to travel to US again.",Mukta Mehta,4045281,43477402,DINING
Giordano's,https://www.zomato.com/chicago/giordanos-pizza-south-loop/reviews,"May 19, 2019",4,Very commercial but I thought it was superb. Each deep dish pizza takes about 45 mins to one hour to be prepared. Looks like they prepare it from scratch. We had the vegetarian one and even the small one was quite heavy. Make sure you are starving when you go here. Staff was super friendly. ,Soumya S.,27937298,43127471,DINING
Giordano's,https://www.zomato.com/chicago/giordanos-pizza-south-loop/reviews,"Oct 05, 2018",5,"After hearing a lot about their deep dish pizzas, we wanted to give it a try. The pizza took good 25-30 minutes to come but trust me it was worth the wait. We just couldn't get enough of it and craved more. It was definitely one of the best I've had when it comes to deep dish. Good place to go if you're a pizza lover. ",Anant Gupta,16054980,39446203,DINING
Giordano's,https://www.zomato.com/chicago/giordanos-pizza-south-loop/reviews,"Jul 25, 2018",5,"The famous #deepdishpizza was why we went in there. You can simply never have enough of the pizzas. The ambience is quite chill. The crowd is good. Although it took quite some time for them to serve us, it was definitely worth the wait. A must try if you're in Chicago!",Rishika Mitra,52448707,37819311,DINING
Giordano's,https://www.zomato.com/chicago/giordanos-pizza-south-loop/reviews,"Dec 30, 2017",3.5,"Giordanos deep dish pizza, one of the most famous things to try, being a vegetarian, I had to try the veg deep dish, so a disclaimer for that. The pizza was gud, they take gud 30-40min to get this done, each spice of pizza was heavy to the stomach I could manage just 2 spice with great difficulty. I would give 3.5 rating as the pizza somehow didn't appeal too much to my raste uda. They were fine to fill your somtach. Next time I would father prefer a thin trust that deep dish.",Atit Goel,29666026,32950064,DINING
Giordano's,https://www.zomato.com/chicago/giordanos-pizza-south-loop/reviews,"Dec 03, 2017",4,"I had the famous deep dish pizza over here, the restaurant is very good from the ambience and service point of view. The have a good bar as well as food menu. The location is perfect and the courteous staff makes it even better. The pizza was great though I did not go for a freshly baked one. ",Nilesh Naik,15613555,32631891,DINING
Giordano's,https://www.zomato.com/chicago/giordanos-pizza-south-loop/reviews,"Nov 01, 2017",3.5,"I tried the veggie deep dish pizza here. It was good but not great. We had a 45min waiting time and it took them another 45mins to bring us the order! I wish that the  service was a little faster. Apart from that, the pizza was enjoyable. The staff  members are sweet and welcoming. Ambience is noisy, but not bad for a pizza place! ",Medha,34133003,32263043,DINING
Giordano's,https://www.zomato.com/chicago/giordanos-pizza-south-loop/reviews,"Oct 08, 2017",2,"Too crowed, too noisy and too overrated. Tried the thin crust pizza and the dough came out undercooked and tasted badly. If you want to eat a normal pizza (thin crust) definitely this is not the place to go. ",João Filipe Neves,29528122,31991352,DINING
Giordano's,https://www.zomato.com/chicago/giordanos-pizza-south-loop/reviews,"Oct 02, 2017",5,My first experience having the famous chicago pizza! It was soo good we couldn’t stop eating it! We also ordered the tomato bruschetta and it was just exquisite! Definitely going back! ,FoodLover,27423088,31935514,DINING
Giordano's,https://www.zomato.com/chicago/giordanos-pizza-south-loop/reviews,"Sep 27, 2017",4.5,"The best pizza on planet so far is available  at GIORDANO’s guys. Waiting for 2 long hours  for my deep dish pizza was a worth waiting for . Im from india 🇮🇳 i would definitely visit Giordano’s whenever I’ll come to Chicago or united states 🇺🇸 and from the first bite till the  end i received  the  same joy . It was beautifully prepared and the crust of the pizza was awesome .. we had couple of beers over there , we customised our pizza And it was a great evening .. our whole stomach was stuffed with great taste and flavours of that amazing pizza .🍕 ",Rachit Garg,29509983,31868511,DINING
Giordano's,https://www.zomato.com/chicago/giordanos-pizza-south-loop/reviews,"Sep 14, 2017",4,The pizza here is rather good. I had the deep dish & thin crust pizza. The portions are rather large. The drinks were mediocre but passable. The service was very good. I also had the fudge brownie dessert thing and really enjoyed that. The only thing keeping this from being 5.0 is the drinks my 1st pizza being incorrect and minor things with the 2nd pizza that I did not like. ,Courtney Griffith,28078921,31727694,DINING
Giordano's,https://www.zomato.com/chicago/giordanos-pizza-south-loop/reviews,"Sep 11, 2017",4,şikago daki iyi pizzacilardan. Sira beklemeyi goze almak gerekiyor. Rezervasyon yaptirmak zor. Baslangic olarak mozzeralla ve greek salad lezzetli.  Pizzanin gelmesi cok vakit aliyor. Oldukca lezzetli. Kalin ve bol malzemeli geliyor. ,Zorbegenen,41486432,31697881,DINING
Giordano's,https://www.zomato.com/chicago/giordanos-pizza-south-loop/reviews,"Mar 28, 2017",4,Pizza was so very good - I don't like traditional pizza so I got a deep dish specialty while my family got a more traditional deep dish.  It takes a while to bake but worth the wait!  Our waiter was nice - but had too many tables to keep up so service was just ok.  I wish I could say the same for the 'host' who I'd describe as grumpy and unfriendly.  I'll be back for the pizza - despite the service. ,Welovefood,23126161,29881818,DINING
Giordano's,https://www.zomato.com/chicago/giordanos-pizza-south-loop/reviews,"Sep 08, 2016",4,Experienced deep dish pizza for the first time and it was mind blowing.. OMG I would say.. Had to wait for about an hour to get a table but the wait was worth it.. the staff at service was great and they were quick.. we didnt even wait for 5mins for our pizza.. great place to enjoy ur stuffed pizza with a bunch of friends while having a good chat.. ,Shehan Irundika,16437070,28153839,DINING
Giordano's,https://www.zomato.com/chicago/giordanos-pizza-south-loop/reviews,"Aug 17, 2016",4,"Woooho... Mindblowing.. Love this deep dish pizza!  This place was so good we stopped in a second night before we left town! I have never had deep dish pizza before and what better place to have it than in Chicago?! This place was recommended to us by friends. It's all about the pizza here.  It takes time to cook a deep dish pizza here, so you place your order before you get seated.  A 20 minute wait is no problem here, since they will still be cooking your pizza and they have a nice bar off to the side.   We had a deep dish veggie pizza that was excellent! The pizza was like a pie/lasagna. It was stuffed full of the ingredients with some herbs. I would have liked a little more spice but I was able to add chilli flakes and hot sauce to give it that extra zing that I like in a sauce. The service was excellent and the atmosphere was warm and friendly. It's great for families and larger groups of people. So glad we stopped here!The salad we ordered for the table (pretending to be respectable) was also very good fresh and the house dressing is outstanding.  Can't imagine visiting Chicago again without stopping in here!",Indorifoodcop,27889439,27945177,DINING
Giordano's,https://www.zomato.com/chicago/giordanos-pizza-south-loop/reviews,"Jul 28, 2016",2.5,"My husband and I went to this Giordano's last night before a soccer game at Soldier Field. We've both been to Giordano's before, so we knew the pizza would be great and we knew the restaurant would be busy.  We got there around 5:15. We didn't have to wait for a table, but it was clear things were hectic. The hosts/hostesses looked frazzled, and the servers were rushing around.  The tables in this restaurant are really packed in. There is only room for one person to walk between tables, so this kinds of adds to the stressed atmosphere as you see servers rushing around with food and drinks trying to navigate between furniture and customers and each other.   We sat for 20 minutes before anyone came to take our drink order. We had seen our waitress rushing around that whole time, not knowing she was our waitress yet. She was definitely not slacking. I noticed the servers don't carry anything on trays there (maybe because there's not enough room to carry trays), so just trying to refill the drinks of the large party next to us took her 3 or 4 trips. I felt a little bad for her.   So after she took our drink and food order, she brought us our water another 10 minutes later (30 minutes seated without a drink), and she didn't come back until 3o minutes later when she dropped off our pizza. She didn't say anything when she dropped it off. Just set it down and left. She didn't come back again until we were done. No drink refills, didn't check on us, nothing. But we could still obviously see how busy she was.   This was not just us, by the way. A party of 6 seated near us was there for a very long time (at least 3o minutes, and I think longer) before she brought them their drinks. We saw another server go to the host station and ask if a certain number table belonged to her. They confirmed that it did, and we heard her say ""Sh**!"" and rush off toward them. Who knows how long they were sitting without service.   After our waitress brought us our check, we put in our credit card right away, but it took her at least 15 minutes to come back and get it, and then we waited several more minutes before she brought it back. She just kind of said to have a nice night.   So....The server wasn't rude, but just overstretched and largely absent.   The worse part was that we were sitting close to the host station, and that was absolutely obnoxious. It started to get really crowded, and there isn't enough room for people to wait, so it felt like there were a lot of people standing very close to us and talking loudly while we were eating. I guess that's just part of the atmosphere, but it's kind of disconcerting.   And for the love of all that is good, this place needs to get some buzzers for people who are waiting for tables. It was really loud in the waiting area, and the hostess was SCREECHING names every 30 seconds. ""John, party of 2? JOHN, party of 2? JOHN?!!?! JOHN?!!!!! JOHN, PARTY OF 2!!!!!!!!!"" (Not the best soundtrack to eat dinner by.)  So, I get it. It's Giordano's. It's a Chicago landmark and a tourist favorite. We were right by Soldier Field and there was a game on. But you would think the management would know what it's like to be slammed and adapt, and have more servers working. ",Liz Overberg,30908925,27773172,DINING
Giordano's,https://www.zomato.com/chicago/giordanos-pizza-south-loop/reviews,"Jul 10, 2016",4,"Friendly staff and decent prices. You get a lot for your money. The small deep dish was more than enough for me and my husband and we're usually pretty big eaters. We did have the fried mozzarella appetizer as well. That was nothing special but met our expectations. The pizza is heavy on the cheese, which I LOVE. Not my favorite pizza place in the area but you won't regret it. Worth the wait for the deep dish. ",Leah Warren Gilliam,33751906,27598934,DINING
Giordano's,https://www.zomato.com/chicago/giordanos-pizza-south-loop/reviews,"May 28, 2016",3.5,Very good deep dish pizza. The thick pies take a little longer to cook so always allow time to sit and wait. We had the classic which was very good ,TN Food Finder,24684450,27201636,DINING
Giordano's,https://www.zomato.com/chicago/giordanos-pizza-south-loop/reviews,"Dec 31, 2015",4,GOOD TASTE ! We called for delivery. And the service was fast. Garlic breads... salads..1 large cheese pizza and fresh tomato bruschetta. The sauces were tasty too.  The paper plates surely does good for the  marketing aspect :)....  i like them though.  ,Nehal Shah,2326798,25878626,DINING
Giordano's,https://www.zomato.com/chicago/giordanos-pizza-south-loop/reviews,"Oct 29, 2015",4.5,"My first meeting with deep dish pizza and I was expecting a lot after the numerous times I've seen it on the telly.    It definitely did not disappoint.  A yummy pie like looking pizza with a crispy non soggy base, all possible preparations of pork slathered in a heavenly tomato sauce with a blanket of stringy soft cheese.  One word.  INDULGENCE.  The flavors worked really well together and it takes just two pieces to make you feel extremely full. Total VFM. The space was slightly cramped but had the busy pizzeria feel to it.  Definitely will visit again on my next trip to Chicago.   ",Priyanka Ganesh,4111741,25360200,DINING
Giordano's,https://www.zomato.com/chicago/giordanos-pizza-south-loop/reviews,"Aug 21, 2015",4.5,As a east coast pizza snob I was expecting a lot worse. Pizza was not my thing but it tasted very good. Although I'm not a deep dish pizza fan it was very enjoyable. The service was very good. No complaints here!,Dan,22539597,24683656,DINING
Giordano's,https://www.zomato.com/chicago/giordanos-pizza-south-loop/reviews,"Oct 19, 2014",0,"Appalling Customer Service. If you are ever in Chicago DO NOT eat at Giordano's... it was the absolute WORST dining experience I have ever had. The server was rude, had a major attitude issue (slammed our drinks and food down every time) and the pizza was terrible.   We asked to see the manager and she said ""you don't want to talk to my manager,"" we told her to get the manager or we were leaving and she said ""you've already ordered your food so we will call the police if you leave.""  Absolute WORST dinning experience ever (I eat out over 100 times a year). We were at the 1340 S. Michigan Ave. and Zuri Q. waited on us. This person needs to be fired. I was embarrassed in front of business clients. I am absolutely appalled and still can't believe that we didn't leave and that I still had the generosity to give this person a tip.",Mkrs1010,25106394,16181779,DINING
Giordano's,https://www.zomato.com/chicago/giordanos-pizza-south-loop/reviews,"Jan 01, 2014",0,This was delicious! I couldn't believe how light the crust actually was - it was flaky and had a nutty flavor to it. I definitely enjoyed this. I wouldn't say I liked it as much as Zoey's but I liked it a lot. One piece was also enough at lunch - it was huge!,Foodhussy,20828323,8803918,DINING
Tapas Valencia,https://www.zomato.com/chicago/tapas-valencia-south-loop/reviews,"Aug 27, 2018",4,"What a fun place! On the first night of our visit to Chicago, we enjoyed choosing, with the help of our very informative and friendly waiter, and sharing several tapas from among the dazzling list of options. And the sangria was amazing!",Sunil K,49689809,38671533,DINING
Tapas Valencia,https://www.zomato.com/chicago/tapas-valencia-south-loop/reviews,"Feb 08, 2018",4.5,"We visited Chicago with my kids(11 & 21). We needed something to eat and it was after 10PM. We took the bus to Portillos. We were going to split a couple of hot dogs and Italian beef. We ended up (with several orders) of 4 hot dogs, 3 Italian beef, cheese fries, custard, tamales and chocolate cake. The hot dogs were unbelievable. I never thought a Chicago dog would be that good. The beef sandwiches were super. We got them all dipped so they were messy. Tamale was good although I think I was already past full when I ate it. It had a dark rich sauce that made this one of the best tamales I have had. Custard was cool and creamy. The atmosphere is cool. There is lots of nostalgia everywhere. I cannot say enough about the hot dog. You cannot separate the ingredients- Vienna all beef frank, tomato, onion, sport pepper, mustard, relish, sour pickle and celery salt, and think this would taste like this. The Italian beef was thin cut and is the most beef you would expect on a 7-8 inch Italian roll for less than $6. I saw an article about the chocolate cake so we had to try that too. It did not disappoint us. This was one of our favorite meals in Chicago.",Shaun Pilay,37987407,33461421,DINING
Tapas Valencia,https://www.zomato.com/chicago/tapas-valencia-south-loop/reviews,"Nov 05, 2015",4.5,Awesome place!  Nice service.  Good wine.  The blood sausage was excellent!  Their selection is broad enough that a newbie to the tapas scene could find something they like.,Eric McHugh,24845686,25423842,DINING
Tapas Valencia,https://www.zomato.com/chicago/tapas-valencia-south-loop/reviews,"Jul 07, 2015",4,"My uncle recommended Tapas Valencia to me as he has dined there several times before. As a large group of people, we came here for lunch because tapas are small plates of appetizers that allows you to try a variety of dishes. We decided to start off with two pitchers of Red Wine Sangria ($29), which was refreshing but on the pricey side. Since the menu had both cold and hot tapas, with such a huge selection to choose from, my uncle was in charge of the ordering as he knew best which items are worth it!",Akira Stephanie,3674261,24203946,DINING
Tapas Valencia,https://www.zomato.com/chicago/tapas-valencia-south-loop/reviews,"Feb 12, 2012",4.5,"$2 & $3 tapas and drink specials,50% on bottles of wine on wednesdays & $5 margaritas, mojitos & Martinies with absolute. Plus the service is amazing",Tony,22614165,16158550,DINING
Tapas Valencia,https://www.zomato.com/chicago/tapas-valencia-south-loop/reviews,"Sep 29, 2010",4.5,"Wonderful experience! Food was fresh, well presented and cooked properly. Plates were garnished beautifully and simple. Staff was very attentive, sharply dressed and friendly. The cleanliness of the room was noticeable. Would recommend highly.",S. Johnson,21516998,16158547,DINING
Tapas Valencia,https://www.zomato.com/chicago/tapas-valencia-south-loop/reviews,"Jun 20, 2010",4.5,"The almond butter cake was spectacular... The duck, almost as good, but pass on the luke warm sangria...",David Roman,21382856,16158544,DINING
Tapas Valencia,https://www.zomato.com/chicago/tapas-valencia-south-loop/reviews,"Apr 13, 2010",0,Take a 360-degree Virtual Tour of Tapas Valencia restaurant,Digispin - Virtual Tours,21163633,9260050,DINING
Flo & Santos,https://www.zomato.com/chicago/flo-santos-south-loop/reviews,4 months ago,4,,H3_test0003,229075224,82338409,DINING
Flo & Santos,https://www.zomato.com/chicago/flo-santos-south-loop/reviews,"Sep 07, 2019",5,,Karen.o.fort,42158726,44923097,DINING
Flo & Santos,https://www.zomato.com/chicago/flo-santos-south-loop/reviews,"Aug 27, 2018",4,The food here is varied and tasty! The bars id great too!The flying pork wings are one of my favorites. My friend really likes their pizza!(It's actually on one of the pizza tours in the city) I really love the pretzel bun with the hamburger!,Gunjan Bali,49678346,38679780,DINING
Flo & Santos,https://www.zomato.com/chicago/flo-santos-south-loop/reviews,"Feb 08, 2018",4.5,I took my sister to the Portillo's in Harwood Heights for lunch this week. She had never been in a Portillo's. She loved it.I took my sister to the Portillo's in Harwood Heights for lunch this week. She had never been in a Portillo's. She loved it.,Shaun Pilay,37987407,33461495,DINING
Flo & Santos,https://www.zomato.com/chicago/flo-santos-south-loop/reviews,"Jun 04, 2015",4,"Delicious blend of polish and Italian cuisine. Pizza is always good, perogi is on point, and definitely try the pork wings. Bartenders and front house staff are the best. The back bar and patio workers seem to always have an attitude. I usually try to sit in the main dining area. Been coming here for years, one of the better south loop spots for beer and pizza. Great place for Bulls bears and Blackhawks games. ",Teddy Wachholz,20652377,23897141,DINING
Flo & Santos,https://www.zomato.com/chicago/flo-santos-south-loop/reviews,"Apr 08, 2015",4.5,"What happens when a Polish woman marries an Italian man? They serve their family homemade Polish and Italian food and inspire a restaurant specializing in pierogies and pizza. Flo and Santos in the South Loop is a restaurant with a fun concept, great food and reasonable prices. Charles and I decided to be low key and celebrate Valentine’s Day a little early with wings, beer and pizza. (That is romantic, right?) Did you know Valentines Day is the second busiest day for restaurants? Mothers Day is the busiest. In an attempt to avoid restaurant craziness tomorrow, we went out to dinner last night, and I will cook dinner for us tomorrow. Charles thought it would be fun to go to dinner and a movie. Ever since we discovered VIP movie tickets with reserved seating (and a bar) at the Showplace Icon we haven’t gone anywhere else – which meant heading out of River North to the South Loop. It was up to me to pick a restaurant. I thought a restaurant that was inspired by a Chicago couple was fitting. Flo (short for Florence) and Santo were the restaurant owner’s neighbors when he was a child. The bottom of the menu, pictured below, tells a little of the story of Florence and Santo. I love the laid back neighborhood feel of the space. When we first walked in I though it was a small narrow space, but most of the room is in the back. The brick walls are decorated with old photos of Chicago. There are enough tvs to watch a game, but not so many that it’s obnoxious. There are two bars, one in the front and one in the back. The patrons were a mix of families, groups of friends, a few couples, and a group of cops. (I have this theory that cops always know where to get a great cheap meal. When I was in Italy I would always ask the police for restaurant recommendations – they took this very seriously often discussing it with amongst themselves before giving a suggestion). Charles and I decided to eat at the back bar. The beer selection is extensive and focused mostly on local brews, but they still had my favorite, Allagash White. The menu has lots of variety. Appetizers include wings, pork wings (something they invented), pierogies and bruschetta. There are also a couple appetizer sampler platters available. We had the wings which I thought were great – meaty and just the right amount of spice. The last time we dined at Flo and Santos we had the pierogies and they were some of the best I have tried. (Did you know that Chicago has the second largest Polish population of any city in the world? Only Warsaw has more Polish people). The entrees include crispy thin crust pizza, along with Polish and Italian classics like Polish sausage and Italian beef. We chose a pizza that was a daily special and was topped with fresh tomatoes, mozzarella, garlic, basil, and a drizzle of balsamic vinegar reduction sauce. I added artichokes to my half since they are my favorite pizza topping. The pizza was cooked to perfection, with the cheese golden brown. The balsamic sauce was sweet and tangy and went very well with the other ingredients. We ordered a large, and were unable to finish it – but we came close. The first time Charles and I went to Flo and Santos we went with a group of 4 friends. The thing about Flo and Santos is that you should take advantage of the variety of the menu. The experience is better when you can order wings, pork wings, pierogies, polish sausage, and pizza and try a bit of everything. We loved the pizza last night, and will definitely be back again. Flo and Santos is a fun place to catch up with friends, and a very convenient place to dine before catching a movie. Flo and Santos is located in Chicago’s South Loop at 1307 South Wabash Ave. It is a short walk from the Roosevelt Red Line stop. They do not take reservations – but we had no trouble getting in on a weeknight.",Kit Graham,27459907,23429795,DINING
Flo & Santos,https://www.zomato.com/chicago/flo-santos-south-loop/reviews,"Jul 22, 2013",4.5,"Would go back in a heartbeat! Service was fast and friendly. Portions were generous. Quirky combination of Italian and Polish dishes. Loved the sampler appetizer, pierogies and polish sausage were great. The ravirogies were delicious!",Lisa P,21452674,16167850,DINING
Flo & Santos,https://www.zomato.com/chicago/flo-santos-south-loop/reviews,"Jul 01, 2012",0,"Just found this place on urbanspoon and was thoroughly impressed. We started with the Polska Sampler. The perogies were delectable and the polish kielbasa was amazingly flavorful. The potato pancake, however, was just average. For dinner we ordered three different pizzas and everyone in my party agreed the sausage and pepperoni were exceptional. The sausage tasted like it was made in-house and the pepperoni is hand cut. Nice thick slices that outshine the standard pepperoni you get everywhere else. In short, I recommend it!",Jesse Rochman,21564414,16167847,DINING
